"created_at","state","code","text","anger","anticipation","disgust","fear","joy","sadness","surprise","trust","negative","positive"
"09","Florida","FL","tylergeorge42 packmanchris ayheitscarter packpride using injuries   excuse just shows ’m right fsu  … httpstcoze7noejurm",0,0,0,0,0,0,0,0,1,0
"09","California","CA","rt bigkushface freddy  icarly dated 2 best friends      ’m  hoe 😒",0,0,0,0,0,0,0,0,0,0
"09","California","CA","designererica27 manjamanseworld mysa tarot card reading  absolutely demonic    giving spirits … httpstcoatubmihcea",1,1,1,1,1,1,1,0,1,3
"09","Washington","WA","hadleydarling  thinks    loving home   mother  will actually ever feed    cares abou… httpstcowtfznxeaeq",0,1,0,0,2,1,0,2,1,2
"09","Texas","TX","carajeffrey  phillies  cards  michael kay pick  poison  guess",1,0,1,1,0,1,1,0,1,1
"09","Texas","TX","rt cbssports   cardinals loss tonight albert pujols career  officially   accolades include 

3x mvp
11x  star
2x w…",1,2,0,1,1,1,0,1,1,3
"09","Washington","WA","rt gretchenwhitmer abortion   fundamental right  ’m  everything   power  defend access  care  michigan",0,0,1,2,0,1,0,1,1,2
"09","New Jersey","NJ"," picard s3 trailer reminded   much  miss akaworf  wish ’d   captain worf show ’ve  pitching  years",0,0,0,0,0,0,0,1,0,1
"09","Illinois","IL","rt keemwinsagain  dont care    huntor tk gedo  whoeveri aint ever calling another grown man papa

  need hugs…",0,0,0,0,0,0,0,0,0,0
"09","Illinois","IL","rt katiejwoo final phillies 2 cardinals 0

st louis   eliminated   first round   postseason   third straight ye…",0,0,0,0,0,0,0,0,0,0
"09","North Carolina","NC","carissa1177 ’m sure  will ’ll give   full review tomorrow",0,1,0,0,0,0,0,0,0,1
"09","Texas","TX","rt megkoush among    ways mexican week  gbbo   twee little hate crime ’m going   haunted  carole peeling  avo…",2,0,1,2,0,2,0,0,3,0
"09","Arizona","AZ","rt sportscenter   cardinals eliminated albert pujols  played  final game   legendary career 👏 httpstcozjqyeaz64k",0,1,0,0,0,0,0,0,0,2
"09","Massachusetts","MA","mdaixo scene  scene😂😂

“  low vibrations”  love caresha man😂😂😂",0,0,0,0,1,0,0,0,0,1
"09","Nevada","NV","rt elisaperego78    discussing cardiovascular disease following sarscov2 infection  lot  days   crystal clear …",1,0,1,2,0,1,0,0,2,1
"09","Texas","TX","give caresha  emmy right now",0,0,0,0,0,0,0,0,0,0
"09","California","CA","kkdumez harttandsoul ’s  carnival full  carny’s",0,0,0,0,0,0,0,0,0,1
"09","Texas","TX","rt ljera8   done living  life  earth   house car  materialistic item coming  us    living  others opi…",0,1,0,0,0,0,0,0,0,0
"09","Oklahoma","OK","rt tulsateresa  okleg gave govstitt  power  fire  agency boards  health care authority juvenile affairs transportati…",0,0,0,1,0,0,0,1,1,1
"09","Virginia","VA","rt earthdombaby cardinal signs httpstco94zyq6fqpl",0,0,0,0,0,0,0,0,0,0
"09","Pennsylvania","PA","rt fuckcarsreddit ithaca ny 1967 vs 2016 httpstcobzmizujfdy",0,0,0,0,0,0,0,0,0,0
"09","Texas","TX","rt pray2mecca lizzo   pissed   1 time  whole career   wore  4xl tall tee w  ass cut   went  sat co…",0,3,0,1,1,0,1,1,1,2
"09","Iowa","IA","rt azspicedjason blueberry thoughts 38 pt 2  scars  also encouraged httpstcoukwpy9ehjp",0,0,0,0,0,0,0,0,0,0
"09","Tennessee","TN","rt agramuglia   amazing  many people  scared   cancelled    literally    easy  apologize  makin…",0,0,0,0,0,1,0,1,0,1
"09","California","CA","cardinals  guys suck goldy  arenado washed  dodgers better 😂    lose   phillies much less… httpstcolqd8xjkgg6",1,0,1,1,0,1,1,0,2,0
"09","California","CA","rt didthephilslose   revenge  ryan howard  will never forget  never forgive  cardinals  celebrating   field whi…",1,2,0,1,1,0,1,0,2,2
"09","Pennsylvania","PA","rt alexcarrmlb  st louis squirrel ryan howards acl injury  slow collapse   phillies   next decade

 phillies…",1,0,1,2,0,2,0,0,2,0
"09","Georgia","GA","caratxzeal obligatoryasian carolinalbugg jellen805 maga4justice   indeed   like  prints   typically   clothes",0,0,0,0,0,0,0,1,0,1
"09","Georgia","GA","rt bigbeardxxx    take care   ✊🏼🍆 httpstcootjwtsl3y9",0,0,0,0,0,0,0,0,0,0
"09","Pennsylvania","PA","rt iuliiamendel  vasilivka zaporizhzhia region  6000 cars  occupied territories  waiting   checkpoint  leave …",0,0,0,0,0,1,1,0,1,0
"09","Ohio","OH","rt queenocardboard giveaway
 celebration   1 year  magic  will  giving away  4   40k commander decks

 enter

f…",0,1,0,0,1,0,1,1,0,2
"09","Nebraska","NE","rt wyla  face gets smooshed sideways  hes asleep   always ends  looking like  cartoon character   wakes  https…",0,0,0,0,0,0,0,0,0,0
"09","Texas","TX","rt juliannarvivas  hate thinking “okay let  show less love” “let   care soo much”  hate  feeling   never   fee…",3,1,2,2,2,2,1,2,3,2
"09","Nebraska","NE","assusreamus slicedcarpet …lol  cute…toys…grrrr…",0,0,0,0,0,0,0,0,0,1
"09","Pennsylvania","PA","shawnn75 tmz    shirt    think  ppl tht shoot  kill others care   shirt",1,0,0,2,0,1,0,0,2,0
"09","Arizona","AZ"," sound cabin art car powered  budlight goes  like  wild stallion 🤠 don’t miss    way  stage t… httpstcolenkyzbucx",0,1,0,0,1,1,2,1,1,3
"09","California","CA","rt grisserbernard “ artist can   horrible person   don’t care  art  still hot”

go ahead bro  don’t care    …",2,1,1,1,1,1,1,1,1,3
"09","Florida","FL","   high  care …",0,0,0,0,0,0,0,0,0,0
"09","Pennsylvania","PA","mlbonfox cardinals  know    3rd guy retiring     threesome   shared  histor… httpstcohsbbg2yodp",0,0,0,0,0,0,0,0,0,0
"09","Colorado","CO","rt queenocardboard giveaway
 celebration   1 year  magic  will  giving away  4   40k commander decks

 enter

f…",0,1,0,0,1,0,1,1,0,2
"09","Ohio","OH","rt elikasadeghi brave girls  iran removing  headscarves tearing  pictures   supreme leaders   islamic republic …",0,0,0,0,0,0,0,0,1,1
"09","Florida","FL","cardinalsgifs agreed   cool",0,0,0,0,0,0,0,1,0,2
"09","Missouri","MO","eg217 bluesfanatic quinnstlcards fire   ",0,0,0,1,0,0,0,0,0,0
"09","New Jersey","NJ","rt chgocubs october wins

cubs 3
cardinals 2",0,0,0,0,0,0,0,0,0,0
"09","Texas","TX","boleyntea    great  hear ’ve always wanted  work  makeup  just  scared  jump industries 🫠",0,0,0,0,1,0,0,0,0,1
"09","Kansas","KS","cdub23450 carsonokc  mean  pathetic       go  route   team  undefeated 😂",0,0,1,0,0,1,0,1,1,0
"09","Texas","TX","rt kingojungle update   daycare employees torturing little children    month  one   mask  three others …",0,0,0,0,0,0,0,0,0,0
"09","California","CA","rt domfrederic cardinals fans leaving  elimination game early  2   9th truly  best fans  baseball httpstcoeojfo8d…",1,0,1,1,0,1,0,0,1,0
"09","South Carolina","SC","azriouloshi listen  theres  pokemon  defines  best   one   spooky scary outer face prot… httpstcowdi7gqfq6h",0,0,0,0,0,0,0,0,0,0
"09","Pennsylvania","PA","rt alexcarrmlb  thats  combined 13 scoreless innings   zack wheeler  aaron nola  begin  phillies postseason  …",0,0,0,0,0,0,0,0,0,0
"09","Colorado","CO","rt sportscenter   cardinals eliminated albert pujols  played  final game   legendary career 👏 httpstcozjqyeaz64k",0,1,0,0,0,0,0,0,0,2
"09","Connecticut","CT","rt inspectorstocks twitter banned dr peter mccullough  106   wellresearched video  myocarditis  children   final st…",0,0,0,0,0,0,0,0,0,0
"09","New York","NY","funny  used  work    really don’t   care   money",1,1,0,0,1,0,1,2,0,2
"09","Arizona","AZ","rt subk1977  oscars banned will smith  10 years  slapping chris rock  brett farve  banned  10 years  hall  fa…",0,0,0,0,0,0,0,1,0,1
"09","New York","NY","rt gretchenwhitmer abortion   fundamental right  ’m  everything   power  defend access  care  michigan",0,0,1,2,0,1,0,1,1,2
"09","Wisconsin","WI"," cus threatening  key  car   stop talking    insane 😭😭",2,0,1,2,0,0,0,0,2,0
"09","California","CA","rt caseytaylorrr  really dont care  nobody think   😭   life ",0,0,0,0,0,0,0,0,0,0
"09","Texas","TX","rt heyhoneyrae  intuition  scaring  sometimes  don’t know    knowing shitbut  can feel ",0,0,0,0,0,0,0,2,0,3
"09","Pennsylvania","PA","rt kokebtsama 17
tigray   health care access pregnant mothers  z outskirts  travel 
  call  ambulance …",0,0,0,1,0,0,0,1,0,0
"09","Georgia","GA","maybe ’s   low expectations   card    entertaining     ppv’s  year…… httpstco29rd9eefto",0,1,0,0,1,0,0,0,0,1
"09","Arkansas","AR","jabsmusic cardinals sad nightweekend 😢",0,0,0,0,0,0,0,0,0,0
"09","Arizona","AZ","rt kadexxx6  kind  cardio     httpstcofkwla3s8tw",0,0,0,0,1,0,0,1,0,1
"09","Oklahoma","OK","rt jaredcarrabis thanks    memories albert see   cooperstown httpstcocfamaw74j1",0,0,0,0,0,0,0,0,0,0
"09","California","CA","rt euanashley excited  share  preprint  new work   group dissecting  genetics  cardiac flow volumes  1n
httpstcoc…",0,2,0,0,2,0,1,2,0,3
"09","California","CA","rt sportscenter   cardinals eliminated albert pujols  played  final game   legendary career 👏 httpstcozjqyeaz64k",0,1,0,0,0,0,0,0,0,2
"09","New York","NY","rt nytimes half  medicare beneficiaries will   private medicare advantage plan  next year  new york times review  lawsuits…",0,1,0,0,0,0,0,0,0,1
"09","Texas","TX","rt letdaddyteach  really dont care   daughter can breathe     nut   exists    holes violated  dad…",0,0,0,0,1,0,0,0,0,1
"09","Florida","FL","rt andresportsfan fuck  cardinals btw",0,0,0,0,0,0,0,0,0,0
"09","Florida","FL","rt zhizhuweb politicussarah acosta “ don’t care  herschel walker paid  abort endangered baby eagles  want control   senate…",0,0,0,1,1,0,0,2,2,2
"09","Florida","FL","rt themeghaning conservatives 16   young   person  receive trans medical care

also conservatives 10  just right  chi…",0,2,0,1,1,0,1,1,0,2
"09","Pennsylvania","PA"," hate  cartier bul",1,0,1,1,0,1,0,0,1,0
"09","Connecticut","CT","h4lwrestlingpod    different bray wyatt   triple h done gave   whole car  drive 🔥   run",0,0,0,0,0,0,0,0,0,0
"09","California","CA","  scarier wrestling moves  jacob fatu suicida’s wcride",0,0,0,0,0,0,0,0,1,0
"09","Pennsylvania","PA","mlbonfox cardinals cya never bums",0,0,0,0,0,0,0,0,0,0
"09","Iowa","IA","joshyoder jamesclinic usfreedomflyers   miss  sentence risk   allcause  
cardiacrelated… httpstco3sltbiw3un",1,2,1,2,0,1,0,0,2,0
"09","Michigan","MI","rt mariners  first career save feeling 😃

seausrise  embracethechaos httpstcotpixsevsib",1,2,1,1,2,1,1,2,1,3
"09","Iowa","IA","illinisports06 hawkeyeziqi biggameboomer chrisfallica     lowest yards per carry  didn’t scor… httpstco9hlmwtqti7",0,0,0,0,0,1,0,0,1,0
"09","Virginia","VA","rt fanduel whose career   rather  🤔

❤️  eli manning 
🔁  russell wilson httpstco7wu29ztp83",0,1,0,0,0,0,0,0,0,1
"09","Indiana","IN","rt ballysportsmw marmol   stlcards  swept    wildcard series  disappointed anything short   world series…",1,0,1,0,0,1,0,1,1,0
"09","Nebraska","NE","im  christian  patriotic   point  blow  cover  twitter  cartel niggas watch",0,1,0,1,0,0,0,1,1,0
"09","Idaho","ID","tuckercarlson youre  clown    heye",0,1,0,0,1,0,1,0,0,1
"09","Florida","FL","rt espe21 spooky month continues 

likert  win  cards  booster packs 👻 picked next friday   great weekend httpst…",0,0,0,0,0,0,0,0,0,0
"09","Vermont","VT","sunnylass17   rough     emotional connection  history together just   careful… httpstco7sbxaxwy9x",0,0,0,0,0,0,0,0,0,1
"09","Arizona","AZ","rt acyn jennings  think  see joe biden  weak
carville  know  doesn’t think biden  weak vladimir putin  republican h…",0,0,0,0,0,0,0,0,0,0
"09","Idaho","ID","rt karengillan scaren ghoullan  back 👻🎃👻",0,0,0,0,0,0,0,0,0,0
"09","Texas","TX"," ex called  today    driving  scared tf    just  ask    working tn   dog  … httpstcop5q4wdjsf4",0,0,0,0,0,0,0,0,0,1
"09","Florida","FL","rt thefuckingvoice    angela basset’s oscar emmy amp tony httpstcosm9lpycklc",0,0,0,0,0,0,0,0,0,0
"09","South Carolina","SC","rt rivalswardlaw 23  prepspalmetto rivals front plotting hillcrest qb bennettjudy1 article commitment  western car tag team …",0,0,0,0,0,0,0,1,0,0
"09","New York","NY","face card viral 😘 httpstcof3znufe87u",0,0,0,0,0,0,0,0,0,0
"09","Massachusetts","MA","metvkolchak  carl ever hand   stories  tony  even finish writing    matter",0,0,0,0,0,0,0,0,0,0
"09","Iowa","IA","rt cubszone kyle schwarber  never lost   cardinals   postseason httpstcolqtkl2civ0",0,0,0,0,0,1,0,0,1,0
"09","Texas","TX","rt kloogans whenever  smell weed  body starts  float  follow  source   smell like  cartoon smelling  freshly baked pie…",1,0,2,0,0,0,0,0,2,0
"09","Texas","TX","secretsqrl123    admit    first time ever  car lost  roof  now lives outside   … httpstcohbskj5nasu",0,1,0,0,0,1,0,0,1,0
"09","Oregon","OR","match  inktober  anyone else play  match game   kid  cards  dinosaurs       c… httpstcomfdw1quzem",0,0,0,0,0,0,0,0,0,0
"09","Florida","FL","rt cardinals thank  pujolsfive  12 incredible seasons   unforgettable final year httpstcondinewptgg",0,0,0,0,0,0,0,0,0,0
"09","Michigan","MI","rt goddamnitjeremy good samaritan stops  carjacker
 world needs  heros like  httpstcoxippjyl5hb",0,1,0,0,1,0,1,1,0,1
"09","Connecticut","CT","rt sportscenter   cardinals eliminated albert pujols  played  final game   legendary career 👏 httpstcozjqyeaz64k",0,1,0,0,0,0,0,0,0,2
"09","Colorado","CO","    gym    fox news  one   tvs    tucker carlson jason whitlock  kanye  ca… httpstcopylarijkop",0,0,0,0,0,0,0,0,0,0
"09","Montana","MT","   highlight video    scoring plays  footballcarroll’s win  msunorthern ⬇️

mtscores httpstcorhbneqmswo",0,0,0,0,0,0,0,0,0,0
"09","Washington","WA","rt softykjr alds schedule game times coming later possible g4  seattle  day  hawkscardinals httpstcog285sqf1nw",0,1,0,0,0,0,0,0,0,0
"09","California","CA","rodeo graduation  care     top3 favorite albums   time",0,3,0,1,2,0,1,3,0,3
"09","Maryland","MD","uhcaribe inprnt iphone casessssss 👀👀👀👀👀👀 httpstcowegdkwijly",0,0,0,0,0,0,0,0,0,0
"09","Indiana","IN"," russians carried  three missile  26 air strikes   day  also fired 75 volleys  mlrs 

uk… httpstcoblaivkxyuf",0,0,0,1,0,0,0,0,0,0
"09","Tennessee","TN","matthmorgeson greensplatter yeah  didnt count   total collapse   lead card lol",0,0,1,1,0,1,0,1,1,2
"09","California","CA","rt ljera8   done living  life  earth   house car  materialistic item coming  us    living  others opi…",0,1,0,0,0,0,0,0,0,0
"09","Indiana","IN","rt sweetie4baby meet hot girl next door    🔥
 sign   email  credit card required
 👉 date  sex  free httpstc…",1,1,0,0,2,0,0,2,0,4
"09","Maryland","MD","rt benfred former stlcards infielder edmundo sosa ends  thats  season folks offense just   come  ",1,0,1,1,0,1,0,0,1,0
"09","Pennsylvania","PA","rt mattdonnelly howie mandell just opened  carouselofhope gala saying   6th gig  3 years thanks  covid  told jokes …",0,0,0,0,0,0,0,0,0,0
"09","Kansas","KS","stanfinger yeah seems like   walk judge  ramirez  rest   lineups    scary  bet  yank… httpstcobkgdeuizua",0,0,0,0,0,0,0,0,0,1
"09","North Dakota","ND","rt bornakang y’ scared  moan   girl ear      like httpstcopb0nxkvhvb",0,0,0,1,0,1,0,0,0,0
"09","California","CA","espn 😔😩😭😭😭😭🤬 stlcards 
another losing postseason   first round
disappointing   2 “mvps”  ge… httpstconrj9hknhjy",1,0,0,0,0,2,0,0,2,0
"09","New Jersey","NJ","rt gretchenwhitmer abortion   fundamental right  ’m  everything   power  defend access  care  michigan",0,0,1,2,0,1,0,1,1,2
"09","California","CA","rt priinnyvert forgiving people  silence  never speaking      form  selfcare",0,0,0,0,0,0,0,1,0,1
"09","Washington","WA","rt scctradingcards ⚾️ mlb postseason giveaway ⚾️

scc  giving away  2022 topps chrome baseball hobby box  chrome silver pack  en…",0,0,0,0,1,0,0,0,0,2
"09","Florida","FL","now dont get  wrong ion job shame    care  anyone goes  school    actually encourage  paying… httpstco43azjaz5vr",0,0,1,1,1,1,0,2,2,2
"09","Kentucky","KY","rt cardinals forever  cardinals icon 

thank   19 incredible seasons wearing  birds   bat httpstcohe5vgwwfzc",0,0,0,0,0,0,0,0,0,0
"09","Texas","TX","plays playboy carti",0,0,0,0,0,0,0,0,0,0
"09","Wisconsin","WI","kelsofthenight scarlett",0,0,0,0,0,0,0,0,0,0
"09","Georgia","GA","rt cardinals thank  pujolsfive  12 incredible seasons   unforgettable final year httpstcondinewptgg",0,0,0,0,0,0,0,0,0,0
"09","California","CA","rt mlbonfox heroes get remembered  legends never die

 tip   cap  two legendary careers httpstcoyiubwgvyra",0,1,0,1,0,1,0,1,1,1
"09","Oregon","OR","rt laurynipsum  everyone following   unhinged victorian greeting cards—gather  gourds 

’s coming 
🎃 httpstcowomxfwq…",0,1,0,0,0,0,1,0,0,1
"09","Maryland","MD","rt pray2mecca lizzo   pissed   1 time  whole career   wore  4xl tall tee w  ass cut   went  sat co…",0,3,0,1,1,0,1,1,1,2
"09","Texas","TX","rt cardinals forever  cardinals icon 

thank   19 incredible seasons wearing  birds   bat httpstcohe5vgwwfzc",0,0,0,0,0,0,0,0,0,0
"09","California","CA","rt pmrenfro  mccarthyism   second red scare  generally outlived murrow  fact ’re still reckoning    …",1,1,0,1,0,0,1,1,1,0
"09","Mississippi","MS","rt ddavisbradley 🚨shutout alert🚨

belhaven beats north carolina wesleyan 240

belhavenfb belhavenblazers chantz2x zhammett https…",0,0,0,0,0,0,0,0,0,0
"09","New Jersey","NJ","rt realglenmacnow     got  little scary   end     hoped wheeler  nola came  huge bring   brav…",0,0,0,0,0,0,0,0,0,0
"09","Florida","FL","rt biloverforboth  know im obsessed   theres   thing   nasty     dont fucking care  want  ton…",1,0,1,1,0,1,0,0,1,0
"09","California","CA","957thegame ’s   think  don’t care   says  care       case doesn’t  like st… httpstcowurifrg2cg",0,0,0,1,0,1,0,1,1,1
"09","Georgia","GA","rt keairraaaa  red hair phase coming real soon ’m scared tho😂",0,1,0,0,0,0,0,1,0,1
"09","New Jersey","NJ","vanillaopinions carthage",0,0,0,0,0,0,0,0,0,0
"09","Oregon","OR","rt cardinals forever  cardinals icon 

thank   19 incredible seasons wearing  birds   bat httpstcohe5vgwwfzc",0,0,0,0,0,0,0,0,0,0
"09","Oregon","OR","david garrett  pirates   caribbean edited version httpstcofcyxvaj2km via youtube",0,0,0,0,0,0,0,0,0,0
"09","New Jersey","NJ","carlosberkley lakersfan17 shits crazy don’t get  people can’t easily  fans   shit isn’t hard",2,0,1,1,0,1,0,1,2,1
"09","Alabama","AL","wwe y’ know   fuck  everything  get certain people carried  matches   fucking suck … httpstcojw2oz22kwi",0,0,0,0,0,0,0,0,1,0
"09","Wisconsin","WI","rt rachxboyd lol nolan  goldy continuing  let  
save    carrying  team  rest   season ’d rather us n…",0,0,0,0,1,0,0,2,0,2
"09","Alaska","AK","jovlande   upcoming book ink stains amp illfated lies   quite   scary “celebrations”  main character   endure",0,0,0,0,0,0,0,0,0,2
"09","Illinois","IL","carlosberkley  level  hate  dislike   person    nothing  exemplary   single reason… httpstcorsfmthhxzh",2,0,2,1,0,1,0,1,2,3
"09","Florida","FL","rt loafloafloaf1 “ ’s  ferrari   carlos sainz” f1 httpstcogr7skvjmzb",0,0,0,0,0,0,0,0,0,0
"09","Texas","TX","messi0103   agree  hes like  whiny bitch weasel version  tucker carlson",1,0,1,1,0,1,0,0,1,1
"09","Ohio","OH","rt spawnofcupid  don’t wanna get close  anybody else     care  much amp people care  little amp  ’m left looking cra…",0,0,0,0,0,0,0,1,0,1
"09","Oregon","OR","navybrat1972 caroljsroth    movie  actually started  obsession  pride amp prejudice",1,0,0,0,1,0,0,0,1,1
"09","New York","NY","rt pray2mecca lizzo   pissed   1 time  whole career   wore  4xl tall tee w  ass cut   went  sat co…",0,3,0,1,1,0,1,1,1,2
"09","Washington","WA","therickwilson  really dont care",0,0,0,0,0,0,0,0,0,0
"09","Georgia","GA","rt cartunenetwerk top 3 funniest mogs   time httpstcolopnihuhsc",0,2,0,0,0,0,0,1,0,1
"09","Arizona","AZ","rt politicussarah james carville  acosta  herschel walker  man neglects  children  doesnt acknowledge   …",0,0,0,0,0,0,0,0,0,0
"09","Maine","ME","rt talkinbaseball two hall  fame careers  come   close httpstcoh1clgvyak7",0,0,0,0,0,0,0,0,0,1
"09","Texas","TX","rt sadedposts  miss  please take care",0,0,0,0,0,0,0,0,0,0
"09","Florida","FL","greyalien im missing  hacked  816 bit computer used  freeze frame cart  repaired  8bit computer… httpstconfrlgbo04e",0,0,0,1,0,1,0,0,1,0
"09","New York","NY","itsbiggtoby  sorry  hear toby’s diagnosis  know  family will shower   love take care 🐾🙏❤️",0,1,0,1,1,0,0,1,1,1
"09","California","CA","rt themeghaning conservatives 16   young   person  receive trans medical care

also conservatives 10  just right  chi…",0,2,0,1,1,0,1,1,0,2
"09","California","CA","rt purepeanutty farigiraf giving  alien vibes❤️🤩
pokemonscarletandviolet digitalartist httpstco9lwhgomlbe",0,0,1,1,0,0,0,0,1,1
"09","California","CA","rt narc410    swap wings   incident   first feature  austinmccarl17a still drives  cbracing88 machine   t…",0,0,0,0,0,0,1,1,0,1
"09","North Carolina","NC","rt ricardwalker post  best dick pic  comments 🍆📸 httpstcoiccfv176i1",0,0,0,0,0,0,0,0,0,0
"09","Indiana","IN","rt cardinals thank  pujolsfive  12 incredible seasons   unforgettable final year httpstcondinewptgg",0,0,0,0,0,0,0,0,0,0
"09","Wisconsin","WI","rt wishzen   open  united state bank account  credit card   foreign citizen

without   ssn    travel  …",0,0,0,0,0,0,0,4,1,3
"09","California","CA","rt rainmaker1973 cardboard boxes can  quite versatile packaging especially   learn  resize  recycle   series  sim…",0,0,0,0,0,0,0,1,0,1
"09","Pennsylvania","PA","rt mlberrors  cardinals  19   last 10 playoff games",0,0,0,0,0,0,0,0,0,0
"09","West Virginia","WV","taking  bike ride  north carolina instead  driving  car will largely lessen emissions bike  way   c… httpstcob3tx28r6cd",0,1,0,0,0,0,0,0,1,0
"09","California","CA","javierjmorales nah   carrying  like  loaf  bread lol",0,0,0,0,0,0,0,0,1,0
"09","Illinois","IL","rt beyoncehours  carters httpstco3phpxsdidp",0,0,0,0,0,0,0,0,0,0
"09","Kentucky","KY","engineersfeed red cars sale faster  therefore  command  higher resale value",0,0,0,0,0,0,0,0,0,0
"09","Missouri","MO","joelavellesongs itsmegangraves robintran04 ’s  halloween show     like    scary",0,0,0,0,0,0,0,1,0,0
"09","Tennessee","TN","rt kelly4arkansas  opponent   theproblem  jonstewart  defend arkansas’ safe act  bans gender affirming healthcare cur…",2,1,2,3,1,0,0,1,2,2
"09","Michigan","MI","rt marymargolohan women’s marcher “ abortion banned means …now      careful    sex” httpstcofc8yllk…",0,1,1,1,1,1,0,1,1,2
"09","Connecticut","CT","rt sportscenter   cardinals eliminated albert pujols  played  final game   legendary career 👏 httpstcozjqyeaz64k",0,1,0,0,0,0,0,0,0,2
"09","Tennessee","TN","rt harleyride   gaza  ukraine  anyone care httpstco0h4pyw89my",0,0,0,0,0,0,0,0,0,0
"09","Arizona","AZ","rt brahmresnik update planned parenthood  arizona abortion care resumes effectively immediately
▶️ second az abortion law  ban afte…",0,1,1,1,0,1,0,1,3,1
"09","Illinois","IL","  anything ’s ridiculous   division champ   go   wild card series screw  manfred stlcards",1,0,1,0,0,0,1,1,2,0
"09","California","CA","rt pray2mecca lizzo   pissed   1 time  whole career   wore  4xl tall tee w  ass cut   went  sat co…",0,3,0,1,1,0,1,1,1,2
"09","Pennsylvania","PA","wiscofanatics yelichfans brewers  happened now lmao smoked  cards  brewers ain’t even make postseason lmfao learn baseball",0,0,0,0,0,0,0,0,0,1
"09","Nevada","NV","  feeling like ’m   friends emergecy contact   get scared   call  😂😂",1,1,1,1,1,1,1,1,1,2
"09","Michigan","MI","topdrawercardz yunginyu myldesouthsport champcityla bleacherreport highlighthicks  don’t  dude worship … httpstcov8nmj8p4vk",0,1,0,1,1,0,0,2,0,2
"09","Virginia","VA","iamjessicarosee blind ass better wear  glasses four eyes 😂🤣",0,0,0,0,0,0,0,1,3,0
"09","Utah","UT","presidentaz   people know   azeri oil company socar   terrorist organization httpstcoqqad8euqig",1,1,1,1,1,1,2,1,1,1
"09","Wisconsin","WI","rt tulsigabbard  biden admin   care   american people permanent washington loots us  serve  interests   arms…",0,0,0,0,0,0,0,1,1,0
"09","Wisconsin","WI","sofiaclb sofiacarson fascinating pic   signing  photo  ins  outs  eyebrows look like   modern style  ",0,0,0,0,0,0,0,0,0,1
"09","California","CA","carolina  playing empty cascade  scalping  httpstcoezhezvqlta",0,0,0,0,0,0,0,0,0,1
"09","Washington","WA","rt cadmvbot customer  based   cartoon family guy    friend quagmire says  meaning really just something funny…",0,0,1,0,1,0,0,1,1,2
"09","North Carolina","NC","lafvin smart robot car 2wd chassis kit  ultrasonic module r3 boardremote compatible  arduino ide diy kit… httpstcoywdkyelhcf",0,0,0,0,0,0,0,0,0,1
"09","New York","NY","rt brownieturd tonight   walk penny  mr sprinkles met  neighbor’s dog  big ole 10 yr old playful poodle penny   scared…",1,1,0,0,1,0,1,2,0,2
"09","Pennsylvania","PA"," just started  …
chriscoleiam mattwallace888 theparagonart infinitesprouts yocarlocarlo… httpstco6mxislp0e8",0,0,0,0,0,0,0,0,0,0
"09","Iowa","IA","rt cardinals thank  pujolsfive  12 incredible seasons   unforgettable final year httpstcondinewptgg",0,0,0,0,0,0,0,0,0,0
"09","Oklahoma","OK","rt thetrekcentral “ fearless leader” 
 michael dorn  sir patrick forgetting   use  microphone

startrekpicard nycc https…",0,0,0,1,0,0,0,2,0,3
"09","Texas","TX","rt carlosberkley lebron produced  documentary   usa team  made   honour   friend  olympic teammate kobe  kobe…",0,0,0,0,1,0,0,2,0,1
"09","North Carolina","NC","idk  needs  hear    careful   pray  ie  praying  peace dont   god  gonna gi… httpstcordyq01utax",0,3,0,2,3,0,1,3,0,4
"09","Georgia","GA","rt vpicsmania tony bobulinski tells tucker carlson joe biden  chairman  hunter bidens overseas business dealings

httpstcori…",0,1,0,1,0,1,0,2,1,1
"09","Texas","TX","rt vivekgramaswamy ’s  good way  tell whether  actually care  free speech principles flipflop  side  using  ta…",0,1,0,0,1,0,1,1,0,2
"09","Nevada","NV","nbcnews  car bumped  curb… omg  tragedy  hope    mouth empty   might   another “wor… httpstcoihgdrnb1zx",0,1,0,1,1,1,2,1,1,1
