"created_at","state","code","text","anger","anticipation","disgust","fear","joy","sadness","surprise","trust","negative","positive"
"11","Massachusetts","MA","jljacobson wallofmoms    discussion thread today  democrats ignoring  secretary  state elections th… httpstcox0c6l81ysd",0,0,0,0,0,0,0,0,0,1
"11","California","CA","rt susanshelley    required signature thresholds  trigger recall elections  city council members  los angeles  sho…",0,1,0,0,0,0,0,2,0,1
"11","California","CA","rt thesliceofanime selection project 💜🧡 httpstcohgoiws3i9b",0,0,0,0,0,0,0,0,0,0
"11","Texas","TX","rt thehill texas secretary  state alex jones unleashed hell   election people httpstcos7s1htzvll httpstcod4rqkomum7",1,0,1,1,0,1,0,0,1,0
"11","Florida","FL","rt amoneyresists putting together  thread  every gop election denier running   house senate  state leadership positions eg…",0,0,0,0,0,0,0,1,0,0
"11","Texas","TX","rt savvyrinu pdp people  resigned    winning  presidential elections

   even hiding ",0,1,1,1,1,2,1,1,1,1
"11","Texas","TX","rt rochelleolaugh1 please support august pfluger’s bill barring noncitizens  voting  local elections  great country  counti…",0,0,0,0,0,0,0,0,0,1
"11","Virginia","VA","rt thedestinywells  look forward  working  indiana county clerks across  state  oversee safe  secure elections insos…",0,0,0,0,1,0,0,2,0,3
"11","Texas","TX","rt deadlinewh  country  taken  granted   people   monitoring elections wanted  actually count votes rather …",0,0,0,0,0,0,0,1,0,2
"11","Iowa","IA","rt sarahforiowa fall     means ’re almost  election day show  support  keep warm  ordering one   cozy swe…",0,0,0,0,0,1,0,1,1,0
"11","California","CA","rt raquelmiamibch 🚨big news   less  one month  election day   race  closer  ever    mother  veteran ru…",0,1,0,0,1,1,0,2,1,2
"11","Texas","TX","rt jackposobiec  scottpresler     

 needs  prayers   calls  everyone  rise   election season  vo…",0,1,0,0,0,0,0,1,1,0
"11","Arizona","AZ","rt azdemparty new video kari lake wants  tell  truth   lets help    truth  lake spews election lies supp…",0,0,0,0,0,0,0,1,0,1
"11","Washington","WA","newsmax now sensanders wants    republican………    election",0,0,0,0,0,0,0,0,0,0
"11","Arizona","AZ","rt katiehobbs arizona tomorrow   last day  register  vote   2022 general election whether ’re registering  vote …",1,2,0,0,1,1,1,2,1,2
"11","Florida","FL","leahbug56 ryersonlaurann mmpadellan disgusting election denier",1,0,1,1,0,0,0,0,1,0
"11","Arizona","AZ","rt amaliada judge finds dejoy harmed  postal service  2020 election balloting interference httpstcozlyraxi2uh",0,0,0,0,0,0,0,0,1,0
"11","Texas","TX","rt marceelias 🚨new north carolina court issues written order denying republican motion  stop  nc state board  election  direc…",1,4,0,1,0,0,0,0,1,0
"11","Minnesota","MN","stop saying michael moore predicted  outcome   2016 election  didnt

   people  make  c… httpstcohixq8g96tx",0,0,0,0,0,0,0,0,0,1
"11","Wisconsin","WI","twitter  blocking discussion   attempt  colorado election officials  register 30000 illegal aliens  v… httpstcoln7bhxhesv",1,1,1,1,0,1,0,0,1,1
"11","Washington","WA","rt hodgetwins  media  saying  elon buying twitter will change  outcome  future elections due   allowing free speech …",0,0,0,1,0,0,0,0,0,2
"11","Virginia","VA","rt politibunny lockdown queen  freefall whitmer drops 30 points  election day nears

 pleases   much … lol  httpstcosx8…",0,0,0,0,0,0,0,0,0,0
"11","Pennsylvania","PA","trillbrodude    great  just hope  shot selection tightens   little   reg season",1,1,0,1,1,1,2,1,1,1
"11","Pennsylvania","PA","rt melmedlarson dems running  magas  making  huge mistake   aren’t running   election denial   opponents…",0,0,0,0,0,1,0,0,2,0
"11","Texas","TX","rt turdmagnificent walshfreedom timryan jdvance1 remember   democrats  election deniers  2016 🤡",0,0,0,0,0,0,0,0,0,0
"11","Ohio","OH","gypsycrusader9 veryniceperso16 redelections timryan incomprehensible",0,0,0,0,0,0,0,0,1,0
"11","Michigan","MI","rt calltoactivism breaking california gov gavin newsom will spend 25 million    reelection campaign money  ask voters  su…",1,1,0,0,1,0,1,1,0,1
"11","California","CA","rt amoneyresists putting together  thread  every gop election denier running   house senate  state leadership positions eg…",0,0,0,0,0,0,0,1,0,0
"11","Michigan","MI","rt christinedrazan  election boils   one question   better     four years ago

  answer   …",0,0,0,0,0,0,0,0,0,1
"11","California","CA","globeandmail  polsters   trudeau winning  majority   last election  else   call  election",0,1,1,0,2,1,1,2,0,2
"11","Florida","FL","heathmayo kemp  sos overseeing   election   widespread voter suppression  conducted  massive… httpstcos3xrahsotc",1,0,1,1,0,0,0,0,1,1
"11","Washington","WA","rt lynnoven repjeffries conniegidice   know republicans  plotting  steal  next election",1,0,0,1,0,1,0,0,1,0
"11","Michigan","MI","rt chuckcallesto breaking report detroit michigan ends contract  konnech election software company following ceos arrested  pol…",0,0,0,0,0,0,0,0,0,0
"11","Alabama","AL","rt realmarkfinchem  election  brought    black box tabulators  wont let us see  code   voter file   run b…",0,1,0,0,0,1,0,0,1,0
"11","California","CA","rt jordanchariton news  amazon warehouse  san bernardino california will  filing   union election  week ont8  become…",0,0,0,0,0,0,0,0,0,0
"11","Massachusetts","MA","rt timryan rush  donation right now  help us beat jd vance  flip ohio blue 

  29 days  election day  donation c…",0,0,0,0,0,1,0,0,0,1
"11","Pennsylvania","PA","mikelee762 josieringelstei novelection2024 oh three fence wind ",0,0,0,0,0,0,0,0,0,0
"11","North Carolina","NC","rt jhogangidley   shameful

whether  stupidity ignorance laziness  maliciousness election laws   broken  thi…",1,0,0,1,0,2,0,0,4,0
"11","Ohio","OH","rt shannonrwatts women 50 may   deciding factor   years elections polling shows many women   incredibly diverse  rel…",0,0,0,0,0,0,0,0,1,1
"11","Florida","FL","rt amoneyresists putting together  thread  every gop election denier running   house senate  state leadership positions eg…",0,0,0,0,0,0,0,1,0,0
"11","California","CA","rt marcus4georgia tomorrow   last day  register  vote  georgia

folks  election  make  break  democracy make s…",1,2,0,0,1,1,2,1,1,2
"11","Texas","TX","rt chrystalshrodes sparksn123 nvintapatr isnt  election interference oh nevermind      republican thats ok",0,0,0,0,0,0,0,0,1,0
"11","California","CA","rt calltoactivism breaking california gov gavin newsom will spend 25 million    reelection campaign money  ask voters  su…",1,1,0,0,1,0,1,1,0,1
"11","New York","NY","rt roguecitizenone 🚨  r  z o n 

    drill  guarantee free  fair elections   protect womens rights  must ele…",0,0,0,0,0,0,0,1,0,3
"11","Arizona","AZ","rt aintscarylarry  mark finchem wants  christmas     election fraud criminals like    arrested finchem   e…",1,0,0,0,0,0,0,0,1,0
"11","Massachusetts","MA","gamoderate  testor  win reelection  manchin won’t  world   peace",0,1,0,0,1,0,0,1,0,1
"11","Michigan","MI","rt puddles2727 democrat members  congress running  reelection voted  pelosi schumer amp biden nearly 100   time
weather th…",0,1,1,0,0,0,0,1,0,0
"11","Arkansas","AR","rt keithingramar   registered  vote  deadline  register  vote  november’s general election  tomorrow don’t miss …",1,2,0,0,1,1,1,3,1,3
"11","Iowa","IA","rt occupydemocrats breaking  panel  political  military experts warns   reelection  donald trump  cause “ end …",0,0,0,1,0,0,1,0,0,0
"11","New York","NY","rt ericholder democracy    ballot  year everywhere    ballot election deniers extremists authoritarian supporter…",0,1,0,0,1,0,0,2,0,3
"11","California","CA","rt amoneyresists putting together  thread  every gop election denier running   house senate  state leadership positions eg…",0,0,0,0,0,0,0,1,0,0
"11","Florida","FL","election deniers   us  nothing  sheep    love  shear   entire body    buttholes  free",0,0,0,0,1,0,0,0,0,1
"11","California","CA","rt marcus4georgia tomorrow   last day  register  vote  georgia

folks  election  make  break  democracy make s…",1,2,0,0,1,1,2,1,1,2
"11","California","CA","rt calltoactivism breaking california gov gavin newsom will spend 25 million    reelection campaign money  ask voters  su…",1,1,0,0,1,0,1,1,0,1
"11","New York","NY","rt jbrown11871 intelligence experts reported    last election cycle russia provided 300 million  funding  conservative cand…",0,0,0,1,1,0,0,1,0,1
"11","Arizona","AZ","rt calltoactivism breaking california gov gavin newsom will spend 25 million    reelection campaign money  ask voters  su…",1,1,0,0,1,0,1,1,0,1
"11","Arizona","AZ","rt debbie156 az 

arizona needs  secretary  state  takes law amp democracy seriously 

mark finchem   maga extremist election…",0,0,0,0,0,0,0,1,0,1
"11","New Mexico","NM","rt jbrown11871 intelligence experts reported    last election cycle russia provided 300 million  funding  conservative cand…",0,0,0,1,1,0,0,1,0,1
"11","Wisconsin","WI","fatdaddio ironstache dems tend  sit  elections   concern",0,0,0,0,0,0,0,0,0,0
"11","Texas","TX","rt chuckcallesto breaking report detroit michigan ends contract  konnech election software company following ceos arrested  pol…",0,0,0,0,0,0,0,0,0,0
"11","South Dakota","SD","drth0rn novelection2024 ohhh really   also know adolf obaffoon also dodged  draft claiming breath… httpstcoy2pyieqy3t",0,1,0,0,0,0,0,0,0,0
"11","Florida","FL","rt mammacica  every democrat voted   sweep  election  november     goal  bluetsunami2022",0,0,0,0,0,0,0,0,0,0
"11","Virginia","VA","rt therecount  wouldn’t trust  doctor  repeatedly botched cancer diagnoses   trust fox news’ preelection warnings

conside…",1,0,1,1,0,1,0,2,1,1
"11","New Mexico","NM","rt amoneyresists putting together  thread  every gop election denier running   house senate  state leadership positions eg…",0,0,0,0,0,0,0,1,0,0
"11","Florida","FL","rt rnjudyflorida georgia👉elect democrat stacey abrams  governor 

❌gop  spending big money  steal  democracy

💥 election …",2,1,0,1,1,1,1,3,1,3
"11","Georgia","GA","rt rothschildmd theyre telling     win  will never allow  democrat   certified   election winner theyre pla…",0,1,0,0,1,0,1,0,0,1
"11","Florida","FL","rt occupydemocrats breaking  panel  political  military experts warns   reelection  donald trump  cause “ end …",0,0,0,1,0,0,1,0,0,0
"11","New York","NY","rt rothschildmd theyre telling     win  will never allow  democrat   certified   election winner theyre pla…",0,1,0,0,1,0,1,0,0,1
"11","New Mexico","NM","rt rscook ken paxton texas ag  still walking around free  running  reelection  year despite   indicted  arres…",0,0,0,0,0,0,0,0,0,1
"11","South Dakota","SD","rt thehill  sprint  election day  fully underway  house republicans  looking past november  eyeing  ’ll   th…",0,0,0,0,0,0,0,1,0,1
"11","New Jersey","NJ","rt democracydocket 🚨court update judge orders bexar county texas  operate  least 388 polling locations  election day 100 …",1,1,0,1,0,0,0,1,0,0
"11","Arizona","AZ","rt ddunn1234 djrothkopf timryan another election denier    banned  running

“ prerequisite   trump endorseme…",0,1,0,0,0,0,1,0,0,0
"11","Texas","TX","rt dallasnews tuesday   deadline  register  vote  texas’ november 2022 midterm elections httpstcotlw7uotluz",1,1,0,0,1,1,1,1,1,1
"11","Texas","TX"," received  mailin ballot   upcoming election   looking forward  executing   fervor httpstcoicdzt1d74m",1,1,0,0,1,0,0,1,0,4
"11","Arizona","AZ","rt electionwiz watch — florida surgeon general joseph ladapo     known two years ago     vaccine  increase…",0,1,0,1,0,0,0,1,0,3
"11","New Mexico","NM","rt lukemixonla senjohnkennedy   extreme
❌  senator running  voted  overturn  election
❌ voted  new roads cle…",0,0,0,0,0,0,0,0,1,0
"11","California","CA","rt rahulbali update  cobb county board  elections  registration rejects 1350 voter registration challenges  ‘lack  probabl…",1,1,0,1,0,1,0,1,2,0
"11","Maryland","MD","rt axios nearly 4  10 republicans  1  4 democrats say theyll blame election fraud   party doesnt win control  congress…",2,0,2,0,0,0,0,1,2,0
"11","New Jersey","NJ","rt 0liviajulianna okay ’m raising  stakes 

  can hit 100k raised  texas democrats — ’ll get  tattoo  election day s…",1,0,0,0,0,0,0,0,1,0
"11","Utah","UT","rt axios nearly 4  10 republicans  1  4 democrats say theyll blame election fraud   party doesnt win control  congress…",2,0,2,0,0,0,0,1,2,0
"11","Tennessee","TN","rt harvard1988 retweet   believe  democracy hangs   balance  election day 2022👇",0,0,0,0,0,0,0,0,0,2
"11","Massachusetts","MA","rt waverly2235 joycewhitevance 👏👏 da willis thank     job amp making election tampering  high priority anyone  break th…",0,0,0,0,0,0,1,0,0,1
"11","New York","NY","rt electionwiz tucker    week dozens  january 6th defendants  still  held  pretrial detention wheres  republi…",0,0,0,0,0,1,0,0,1,0
"11","New Jersey","NJ","rt electionwiz watch — florida surgeon general joseph ladapo     known two years ago     vaccine  increase…",0,1,0,1,0,0,0,1,0,3
"11","Arizona","AZ","rt kevinhaddad08 everyone  participated   last stolen election   mules   thugs  financed  illegal operation …",2,0,1,2,0,1,0,1,2,0
"11","Nebraska","NE","jules31415    didnt lose  election  lost  rigging",1,0,1,1,0,2,1,0,2,0
"11","Missouri","MO","rt 1brezzyb   believe  michael moores prediction will  correct   midterm election
wevegotacountrytosave bluetsunami…",0,1,0,0,0,0,0,0,0,0
"11","Florida","FL","rt jojofromjerz fck yes exwhite house aide cassidy hutchinson  cooperating  georgias investigation  trumps 2020 election …",0,1,0,0,0,0,0,1,0,1
"11","California","CA"," tplf bandits pretend  tigrays legitimate government referring   fraudulent election held  2020  wa… httpstcouvwfftabft",1,0,1,1,0,0,0,0,3,0
"11","Tennessee","TN","tomorrow   last day  register  vote   november 8th election  tennessee  check  registration e… httpstcobynmdct40n",1,2,0,0,1,1,1,1,1,1
"11","California","CA","rt terrynamkung bobbyscott let’s get together  another forum  debate   election

 need  give  voters  direct co…",0,0,0,0,0,0,0,0,0,1
"11","Arizona","AZ","rt roguecitizenone 🚨  r  z o n 

    drill  guarantee free  fair elections   protect womens rights  must ele…",0,0,0,0,0,0,0,1,0,3
"11","Maryland","MD","rt projectlincoln fascism    door election officials like rusty bowers  upheld  oath  office   2020 election pr…",0,0,0,0,0,0,0,1,1,1
"11","New York","NY","rt jessicaramos ’m  inspired   courage   workers organizing  albany’s alb1 amazon warehouse  election   stan…",0,0,0,0,1,0,1,2,0,2
"11","California","CA","realkylemorris election interference",0,0,0,0,0,0,0,0,1,0
"11","Virginia","VA","rt raquelmiamibch 🚨big news   less  one month  election day   race  closer  ever    mother  veteran ru…",0,1,0,0,1,1,0,2,1,2
"11","Minnesota","MN","rt electionwiz tucker    week dozens  january 6th defendants  still  held  pretrial detention wheres  republi…",0,0,0,0,0,1,0,0,1,0
"11","Texas","TX"," party  believes   elections  wins   trusted  power httpstcoqsurb6rexn",0,0,0,0,0,0,0,0,0,0
"11","Illinois","IL","rt timryan tomorrow   last day  register  vote   november general election make sure youre ready httpstcou30ebcduwr",1,3,0,0,1,1,1,2,1,2
"11","New York","NY"," last day  register  vote  novembers election   friday httpstcogold8euour",1,1,0,0,1,1,1,1,1,1
"11","California","CA"," elections  getting real messy  girl said vote   candidate bcuz   one  racist 😂… california   going ",1,1,1,0,1,1,1,2,2,3
"11","Indiana","IN","rt nickroberts317  case  missed  electiondenying cdiegomorales   friends  steve bannon  running   secretary o…",0,0,0,1,0,1,0,0,1,0
"11","Texas","TX","rt thechicks texas  registration deadline   nov 8th election  tomorrow oct 11th make sure   registered httpst…",0,1,0,0,0,0,0,0,0,0
"11","Wisconsin","WI","rt occupydemocrats breaking  panel  political  military experts warns   reelection  donald trump  cause “ end …",0,0,0,1,0,0,1,0,0,0
"11","Ohio","OH","rt electionwiz watch — florida surgeon general joseph ladapo     known two years ago     vaccine  increase…",0,1,0,1,0,0,0,1,0,3
"11","California","CA","rt maggiehassan democrats  fired   knock  doors make calls  put   hard work  wins elections

thank    na…",0,1,0,0,0,0,0,1,1,0
"11","Indiana","IN","rt brandonjsmith5 maurer says indiana shouldnt change  current election laws

 says local election officials need  resources …",0,0,0,1,1,0,0,1,0,1
"11","Texas","TX","rt dallaselections throughout  day well  joined      wonderful partners like univision23dfw  979thebeat  majic ma…",0,0,0,0,1,0,1,1,0,2
"11","New Mexico","NM","  election news go bond question 3   ballot  hugely important   allows higher education institu… httpstcohvhqpatvur",0,1,0,0,0,0,0,2,0,3
"11","Louisiana","LA","rt droz 1 month  election day ’s time  change pennsylvania   can’t afford     farleft radical policies …",0,1,0,1,0,0,0,0,0,1
"11","Kansas","KS","rt rasmussenpoll thus  company screenshots   order    data  us election operations   amp   2020 e…",0,0,0,0,0,0,0,0,0,0
"11","Texas","TX","rt evanmcmullin tedcruz voted  certifying  election  mikeleeforutah worked 14 hour days  find fake electors  trum…",0,0,0,0,0,0,0,0,1,0
"11","Texas","TX","rt hdrewgalloway bexar county elections takes  l  trying  reduce polling locations  grateful  txcivilrights amp organiz…",0,0,0,0,0,0,0,1,0,1
"11","Michigan","MI","rt carikelemen vote  person  election day",1,1,0,0,1,1,1,1,1,1
"11","California","CA","rt murphyajc georgia voters  deadline  register  vote   general election  tomorrow oct 11",1,2,0,0,1,1,1,2,1,2
"11","Florida","FL","registration deadline tuesday  november general election httpstcosu8b7gnl1d",0,0,0,0,0,0,0,1,0,1
"11","Texas","TX","rt pcisbs1 democrats  win without cheating former dem rep gets 30month prison sentence  ballotstuffing election fraud case

ht…",3,1,1,3,0,3,0,0,4,0
"11","Florida","FL","rt realmarkfinchem   want  christmas    arrests  election fraud criminals",1,0,0,0,0,0,0,0,1,0
"11","Nevada","NV","rt baseballgirlnj  will turn 71  election day  take  medication  prevents     stroke  just got  refilled  w…",0,0,0,1,0,1,0,0,1,0
"11","New York","NY","rt crewcrew   election draws closer  want  know     doj    protect election workers  threats  h…",0,0,0,0,0,0,0,0,0,1
"11","Nevada","NV","rt texasjchristian tomorrow oct 11   last day  register  vote  texas   election  ready  vote blue   …",1,3,0,0,1,2,1,1,1,1
"11","Texas","TX","rt raquelmiamibch 🚨big news   less  one month  election day   race  closer  ever    mother  veteran ru…",0,1,0,0,1,1,0,2,1,2
"11","New Jersey","NJ","wsj waiting  november election  vote  republicans   democrat  long  trump   office market    turmoil",2,2,0,1,1,2,2,1,2,1
"11","Massachusetts","MA","ronzo68 cityofboston wutrain ya… cheating  bossnovember 082022…election day  everyone",0,0,0,0,0,0,0,0,0,0
"11","Colorado","CO","rt kathrynresister whats  prediction  2022 midterm elections  will democrats   november 8th

vote retweet",1,2,0,0,1,1,1,1,1,1
"11","Massachusetts","MA","rt sezekwesili lekkimassacre   election issue",0,0,0,0,0,0,0,0,0,0
"11","California","CA","rt lindamintun nevada gop secretary  state candidate promises  make trump president  2024 hes openly promising  change election…",0,0,0,1,0,0,1,1,0,3
"11","Colorado","CO","rt drgjackbrown  democrats  still  confronting  republicans   direness   election   democracy vs fascism",0,0,0,0,0,0,0,0,0,1
"11","Arizona","AZ","rt azdemparty new video kari lake wants  tell  truth   lets help    truth  lake spews election lies supp…",0,0,0,0,0,0,0,1,0,1
"11","New York","NY","rt shehusky   notice  banditry  herdsmen attacks  eased now   approach  2023 election reason   want nigeri…",0,0,0,0,0,0,0,0,0,1
"11","Oregon","OR","rt garyonly fionawebster22 smilan317 love  …don’t  believe anything  read regarding elections please just go vote don’t …",1,1,0,0,2,1,1,2,1,3
"11","California","CA"," midterm elections less   month away ’s still unclear whether republicans will win control  even one… httpstcoy3hgbgxxge",0,0,0,0,0,0,0,0,0,0
"11","California","CA","rt occupydemocrats breaking  panel  political  military experts warns   reelection  donald trump  cause “ end …",0,0,0,1,0,0,1,0,0,0
"11","Georgia","GA","liberty lovers  want  win elections run  republicans httpstcoevjlojenmf",0,1,0,0,1,0,1,1,0,1
"11","Texas","TX","rt ericholder democracy    ballot  year everywhere    ballot election deniers extremists authoritarian supporter…",0,1,0,0,1,0,0,2,0,3
"11","Colorado","CO","rt maddowblog   polling   years senate elections bears     one  skip  
every race really matters 
ever…",0,0,0,0,0,0,0,1,1,0
"11","Nebraska","NE","rt 44magnumblue1 florida  shit tied    nice bow  election night done finished like  old days almost like  miracle almo…",1,1,1,0,1,0,1,1,1,1
"11","Louisiana","LA","rt sankakucomplex sundays sunset selection  httpstcoqqpzk9l5ce httpstcowltupxwimm",0,1,0,0,0,0,0,0,0,1
"11","Texas","TX","rt crewcrew  federal election commission audited  campaign  rep randy weber rtexas uncovering multiple violations  campaig…",0,0,0,0,0,0,0,1,0,0
"11","Minnesota","MN","kemadiggs ossoff  republicans win   honest electionif  democrat wins  election  fixed",1,0,1,1,1,1,0,2,0,1
"11","Florida","FL","rt trendingliberal   scale  110  happy     ted cruz  mitch mcconnell  lost  next election",0,1,0,0,1,1,0,1,1,1
"11","New York","NY","jriddlecult facts0601 seth410  primary   election  literally called  primary election",0,0,0,0,0,0,0,1,0,2
"11","Illinois","IL","rt newsmax  new desantis reelection campaign advertisement  floridas gubernatorial battle features casey desantis  wife  flori…",1,0,0,0,0,0,0,1,1,1
"11","Michigan","MI","rt mammacica  every democrat voted   sweep  election  november     goal  bluetsunami2022",0,0,0,0,0,0,0,0,0,0
"11","Pennsylvania","PA","   know  will win  elections  next year  one thing  already know  sure   atiku will lose ",1,0,1,1,0,1,1,0,1,0
"11","Ohio","OH","rt emekagift100 ipob   nonviolent freedom movement calling  un supervised biafra referendum hence  engage   election…",0,0,0,0,1,0,0,1,0,1
"11","Nebraska","NE","rt jbrown11871 intelligence experts reported    last election cycle russia provided 300 million  funding  conservative cand…",0,0,0,1,1,0,0,1,0,1
"11","Nebraska","NE","zelenskyy clearly won  first round  elections  31 march 2019   second round  21 april 2019  rece… httpstco5913bws0r2",0,0,0,0,0,0,0,0,0,1
"11","Florida","FL","republicans hate  idea  mailin voting bc  depend  low turnout  win elections basically  democra… httpstcoboh2y6mytc",1,1,1,1,0,1,0,1,1,0
"11","Tennessee","TN","paultoger factnbamuse coach k never mention anything  kobe shot selection  just said  didn’t need… httpstconhup2aymta",1,0,0,1,0,1,1,1,1,0
"11","Michigan","MI","rt damiennightwing  oct 102022 pornstaroftheweek psotw selection 

➡️ piperafterdark piperpressmn 

 spicymilf  milfmonday…",0,0,0,0,0,0,0,0,0,0
"11","Florida","FL","rt chuckcallesto breaking report detroit michigan ends contract  konnech election software company following ceos arrested  pol…",0,0,0,0,0,0,0,0,0,0
"11","Georgia","GA","rt raquelmiamibch 🚨big news   less  one month  election day   race  closer  ever    mother  veteran ru…",0,1,0,0,1,1,0,2,1,2
"11","Florida","FL","rt jbrown11871 intelligence experts reported    last election cycle russia provided 300 million  funding  conservative cand…",0,0,0,1,1,0,0,1,0,1
"11","Pennsylvania","PA","rt evanmcmullin tedcruz voted  certifying  election  mikeleeforutah worked 14 hour days  find fake electors  trum…",0,0,0,0,0,0,0,0,1,0
"11","Minnesota","MN","rt amoneyresists putting together  thread  every gop election denier running   house senate  state leadership positions eg…",0,0,0,0,0,0,0,1,0,0
"11","Michigan","MI","lorihoeksema jocelynbenson prior   arrest eugene yu ran konnech inc  us election company   east l… httpstco455nuab8zk",0,0,0,0,0,0,0,0,1,0
"11","Florida","FL","rt electionwiz watch — florida surgeon general joseph ladapo     known two years ago     vaccine  increase…",0,1,0,1,0,0,0,1,0,3
"11","Arizona","AZ","rt michaelhenry4ag debate   crucial part   election process 

voters deserve  hear  candidates stand   issues  c…",1,1,0,0,0,0,0,2,0,3
"11","Pennsylvania","PA","rt occupydemocrats breaking  panel  political  military experts warns   reelection  donald trump  cause “ end …",0,0,0,1,0,0,1,0,0,0
"11","Texas","TX","rt electionwiz breaking tulsigabbard announces ’s leaving  democrat party  gabbard says  dnc    complete control …",0,0,0,0,0,0,0,0,0,0
"11","Mississippi","MS","rt electionwiz breaking tulsigabbard announces ’s leaving  democrat party  gabbard says  dnc    complete control …",0,0,0,0,0,0,0,0,0,0
"11","Florida","FL","rt qorigins   mark finchem —  az gop’s candidate  run state elections — claiming   local journalist  “shilling  soro…",0,0,0,0,0,0,0,0,0,2
"11","Texas","TX","rt electionwiz watch — florida surgeon general joseph ladapo     known two years ago     vaccine  increase…",0,1,0,1,0,0,0,1,0,3
"11","Missouri","MO","hey knock knock missourians 
 4 weeks  electionday
  mombies will never  mean  never tell yo… httpstco17gb2imwvx",0,0,0,0,0,0,0,0,0,0
"11","Alabama","AL","rt gop   28 days  election day 
 
register  vote
httpstcougcdypep56",1,1,0,0,1,1,1,1,1,1
"11","Missouri","MO","rt judicialwatch “ fbi  caught trying  help hunter biden  joe biden just   election    just exposed  week…",0,1,0,1,0,1,0,0,2,0
"11","North Carolina","NC","rt electionwiz breaking tulsigabbard announces ’s leaving  democrat party  gabbard says  dnc    complete control …",0,0,0,0,0,0,0,0,0,0
"11","Iowa","IA","rt electionwiz breaking tulsigabbard announces ’s leaving  democrat party  gabbard says  dnc    complete control …",0,0,0,0,0,0,0,0,0,0
