"created_at","state","code","text","anger","anticipation","disgust","fear","joy","sadness","surprise","trust","negative","positive"
"11","Florida","FL","rt dickesonkathy president donald trump    us president  can save  us   world american politics needs   readjus…",1,0,0,0,1,0,1,2,0,2
"12","California","CA","rt ashtonpittman   2006 donnerkay  offered  interview  presidential candidate joe biden   local trendy restaurant …",0,0,0,0,0,0,0,0,0,2
"12","Massachusetts","MA","rt sarahironside6 republicans will mock president biden  loving  son  wanting   get help    struggling  addict…",0,0,0,0,1,1,0,2,1,2
"12","North Carolina","NC","rt ceomobley donlew87 nasa  maryland president bill  stephen andrews jr used sound devices  drive  insane  staying  char…",1,0,0,1,0,0,0,1,1,1
"12","Arizona","AZ","rt omgno2trump  day  dont prosecute  former president  crimes  committed    leaving office   day  …",1,0,0,1,0,1,1,2,1,2
"12","New York","NY","rt occupydemocrats breaking president biden demands   los angeles officials   busted making racist remarks  black peo…",1,0,0,1,0,1,0,1,2,1
"12","Texas","TX","rt texastribune president joe biden signed  bipartisan bill  monday  will direct   442 million  upgrades  dallas …",0,0,0,0,0,0,0,1,0,1
"12","Oklahoma","OK","rt calltoactivism excellent  conservative group  sued president biden   said  student loan debt cancelation  dis…",0,0,0,0,1,1,0,2,1,2
"12","Florida","FL","rt hugolowell  guardian doj told scotus   trump truly believed  case    dispute   presidential records act…",1,0,0,1,0,1,1,2,2,1
"12","Maryland","MD","rt whitehouse   american rescue plan  president biden’s 2023 budget request  administration  increased federal firef…",0,2,0,0,1,0,1,3,0,2
"12","California","CA","rt occupydemocrats breaking president biden demands   los angeles officials   busted making racist remarks  black peo…",1,0,0,1,0,1,0,1,2,1
"12","Nevada","NV","stoolpresidente  know nothing  football  know even less  hockey",0,1,0,0,1,0,0,0,0,1
"12","Michigan","MI","rt joncoopertweets breaking president biden just negotiated  historic deal   maritime boundary  israel  lebanon

wheres…",0,1,0,0,1,0,1,2,0,2
"12","California","CA","rt johnskeene25 ukrainian president zelenskyy said   nightly address monday  ukraine will   intimidated   strikes …",0,0,0,0,0,0,0,1,0,1
"12","California","CA","rt kerrykennedyrfk theyll join siris frank baker bank  americas brian moynihan  ukrainian president volodymyr zelensky  honore…",0,0,0,0,0,0,0,3,0,3
"12","Illinois","IL","rt brittanyintexas unlike trump biden   treasonfree president  never stole classified secrets  cares  america",0,0,0,0,0,0,1,1,0,1
"12","Indiana","IN","rt wileeliberal  trump  president lavrov   staying   lincoln bedroom freely spouting russian propaganda  obtaining…",0,0,0,0,1,0,1,2,1,2
"12","Michigan","MI","rt bidenswins president biden fixed  family glitch  will now allow   5 million americans  get financial help  th…",0,0,0,0,0,0,0,2,0,1
"12","Virginia","VA","rt joncoopertweets breaking president biden just negotiated  historic deal   maritime boundary  israel  lebanon

wheres…",0,1,0,0,1,0,1,2,0,2
"12","Iowa","IA","senjoniernst spent  day bitching  complaining  democrats    presidents   honking squ… httpstcooug1ekklo5",0,0,0,0,0,0,0,0,1,0
"12","California","CA","rt chuckcallesto breaking report department  justice urges  united states supreme court  reject president trumps maralago raid…",3,1,0,3,0,1,1,3,2,4
"12","Connecticut","CT","rt kamalaharris earlier  year president joebiden signed two executive orders  protect access  abortion care  right  contr…",0,0,1,1,0,1,0,1,1,2
"12","Arizona","AZ","katiehobbs   elect ppl  lie  cater  former presidents  go  every american principle … httpstcola1etb7mjv",1,0,1,0,0,1,0,1,1,2
"12","California","CA","rt mikesington psycho expresident trump posts bizarre video vowing revenge put   prison now  motherfuker  dangerous https…",2,1,0,3,0,1,3,0,4,0
"12","Missouri","MO","rt latimes breaking la city council president nury martinez stepped    powerful council presidency monday morning  day af…",1,2,1,1,1,0,0,3,0,3
"12","California","CA"," president joins  long list  california democrats   criticized martinez including mayor eric garcetti… httpstcophcs7fgw8b",0,1,0,0,0,0,0,1,0,3
"12","Ohio","OH","rt occupydemocrats breaking president biden scores  major win  announces  honda  lg energy solution  south korea will build…",0,0,0,0,0,0,0,1,0,4
"12","Minnesota","MN","rt omgno2trump  day  dont prosecute  former president  crimes  committed    leaving office   day  …",1,0,0,1,0,1,1,2,1,2
"12","Texas","TX","danrather kinda like   fired  disgrace  falsifying records   attempt  influence  presidential… httpstcoum68y9zz1h",1,1,1,0,0,1,0,0,2,1
"12","New York","NY","dineshdsouza jofomaga cia 

 deep state shadow government   running  wh   dummy president",0,0,0,1,0,0,0,1,2,1
"12","Connecticut","CT","rt vp  administration  fighting  protect reproductive rights tune   president biden   attend  second meeting   ta…",1,0,0,0,1,0,0,1,1,3
"12","Illinois","IL","rt hugolowell  guardian doj told scotus   trump truly believed  case    dispute   presidential records act…",1,0,0,1,0,1,1,2,2,1
"12","Arizona","AZ","bwitnicki abc joebiden amendments can   proposed  congress   states 

 president  neither… httpstcoio4qhpbgm2",0,0,1,0,0,0,0,2,0,1
"12","Pennsylvania","PA","rt kpjaibur bannonswarroom mitch mcconnell   president trump’s grill—  terrible endorsements  mcconnell’s closest allie…",1,0,1,1,0,1,1,1,1,1
"12","Arizona","AZ","rt therecount vice president kamala harris calls  gov greg abbott rtx dropping buses  migrants outside  house last week  …",0,1,0,0,0,0,0,2,2,1
"12","Tennessee","TN","rt hugolowell  guardian doj told scotus   trump truly believed  case    dispute   presidential records act…",1,0,0,1,0,1,1,2,2,1
"12","California","CA","rt repjerrynadler  applaud  biden admin’s leadership   involved — including pm lapid president aoun   us diplomats —…",0,0,0,0,0,0,0,1,0,2
"12","New York","NY","justintrudeau let  put  comment  justin   president  admire  much   disagree    supporti… httpstcoxk6fixe6ig",1,0,0,0,0,0,0,2,1,2
"12","New York","NY","rt thebradfordfile lol  fbi actually offered  spy one million dollars  dirt  trump  2016   trying  rig  president…",0,0,1,0,0,0,1,1,1,1
"12","Florida","FL","rt victorshi2020 gen z    running  office  president biden amp democrats  also finding new amp creative ways  reach us…",0,0,0,0,0,0,0,1,0,2
"12","California","CA","rt chuckcallesto breaking report department  justice urges  united states supreme court  reject president trumps maralago raid…",3,1,0,3,0,1,1,3,2,4
"12","Ohio","OH","rt guerrierest white house prepares  joe biden’s 80th birthday  november

president pampers may  80  iq sure isn’t
httpst…",0,2,0,0,2,0,1,2,0,3
"12","Mississippi","MS"," needs  run  president",0,0,0,0,0,0,0,1,0,1
"12","New Jersey","NJ","rt trumpster20 “ president   existential threat … number one issue   country  defeating donald trump 

nothing else m…",1,0,0,1,0,0,1,1,1,1
"12","Florida","FL","rt calltoactivism excellent  conservative group  sued president biden   said  student loan debt cancelation  dis…",0,0,0,0,1,1,0,2,1,2
"12","Michigan","MI","nobody cares  ’re  president   hunter   theovalonbet",0,1,0,1,0,1,0,1,1,1
"12","Alabama","AL","theovalonbet  really hate  man like seriously president  ass oh lord   season gone bring",1,0,2,1,0,1,0,2,3,2
"12","Ohio","OH","rt dbongino today  october 11th 2022  joe biden   worst president  us history",0,0,0,0,0,0,0,1,0,1
"12","Pennsylvania","PA","rt tonetalks understand nury martinez cd6nury   posting   presidential resignation   apology  whole process  built…",0,0,0,0,0,1,1,0,1,1
"12","Oklahoma","OK"," son  god    president 

can’t get enough  oklahoma state httpstcog4fkmu8urq",0,1,0,1,1,0,0,2,0,2
"12","Washington","WA","jadehare let  list  facts  

 former president  impeached  withholding aid  ukraine  … httpstco4jpph4oueg",0,0,0,0,0,0,0,2,0,3
"12","Ohio","OH","dickesonkathy ’s  scam site     means click  link    won’t get  new president  christma… httpstcoxexvkrlbj2",0,0,0,0,0,0,0,1,0,1
"12","California","CA","rt latimes president biden believes nury martinez   councilmembers  resign   los angeles city council  racist re…",1,1,1,1,0,1,0,2,1,2
"12","California","CA","rt rcmoya84  president   united states  calling  nury martinez  resign 😱💯",1,0,1,1,0,1,0,2,1,2
"12","Nebraska","NE","rt stoolpresidente negotiations  rico   skip kirk went well httpstcor89icx6doi",0,0,0,0,0,0,0,0,1,0
"12","Arizona","AZ","rt thebradfordfile  fbi capable  trying  throw  presidential election  capable  planning  riot   capitol",1,1,0,1,0,0,0,1,1,1
"12","Arizona","AZ","rt heritage 4 reasons colombia’s new marxist president  alarm american policymakers httpstco9wsbnb0ky9",0,0,0,1,0,0,1,2,1,1
"12","Tennessee","TN","rt thebradfordfile  fbi capable  trying  throw  presidential election  capable  planning  riot   capitol",1,1,0,1,0,0,0,1,1,1
"12","Ohio","OH","newsnomore1 timmygillaspy mikemoroski hey actually youre right  city wasnt named   president… httpstcogtmmr3adst",0,0,0,0,0,0,0,1,0,1
"12","Alabama","AL","rt spectatorindex breaking us president biden says chance  recession   slight",1,0,1,1,0,1,1,1,1,1
"12","New York","NY","globalization   

 need  president  understand     blow   ",0,0,0,0,0,0,0,1,0,1
"12","Georgia","GA","rt calltoactivism excellent  conservative group  sued president biden   said  student loan debt cancelation  dis…",0,0,0,0,1,1,0,2,1,2
"12","Massachusetts","MA","rt timobrien trump’s political operation  spent  money since  left office  lawyers representing  former president   pai…",1,2,0,1,1,0,2,3,1,2
"12","Pennsylvania","PA","rt crewcrew  former president   incited  violent insurrection  also allegedly took classified government documents  reso…",2,0,1,2,0,0,1,1,3,1
"12","Georgia","GA","rt cnn president biden says   prospect   “slight recession”  possible    doesn’t anticipate  – even  experts …",1,0,1,1,0,1,0,1,1,2
"12","Georgia","GA","rt morethanmysle president joe biden will  doling   biggest cola increase  people  social security  40 years  someone o…",0,0,0,0,0,0,0,1,0,2
"12","Tennessee","TN","thenbacentral justintinsley 2024    vote   us president",1,1,0,0,1,1,1,2,1,2
"12","California","CA","rt mchooyah  …  president retweeted  story   😂🇺🇸",0,0,0,0,0,0,0,1,0,1
"12","Arizona","AZ","rt theboveed    bad news  president trump  maga trump2024 trump

httpstcop7hqc40tst",1,0,1,1,0,1,1,1,1,1
"12","Arizona","AZ","rt macfarlanenews national archives  obamahw bush records  

reports  indicate  imply   presidential records …",0,0,0,0,0,0,0,0,0,0
"12","Texas","TX","rt katiepavlich congratulations america  can’t afford groceries thanks   president passing “ billion  trillion 750 million …",0,0,0,0,0,0,0,1,0,2
"12","Minnesota","MN","rt whitehouse   american rescue plan  president biden’s 2023 budget request  administration  increased federal firef…",0,2,0,0,1,0,1,3,0,2
"12","Texas","TX","rt morethanmysle president joe biden will  doling   biggest cola increase  people  social security  40 years  someone o…",0,0,0,0,0,0,0,1,0,2
"12","North Carolina","NC","rt macfarlanenews national archives  obamahw bush records  

reports  indicate  imply   presidential records …",0,0,0,0,0,0,0,0,0,0
"12","California","CA","rt iamchanteezy vice president kamala harris  hillary clinton  owed  apology   right  tulsi gabbard",0,0,0,0,0,0,0,1,1,2
"12","Virginia","VA","rt sethabramson  time given  mbs illegally interfered   2016 presidential election    precisely nothing …",0,1,0,0,0,0,0,0,0,0
"12","Washington","WA","rt hugolowell  guardian doj told scotus   trump truly believed  case    dispute   presidential records act…",1,0,0,1,0,1,1,2,2,1
"12","Pennsylvania","PA","  vote  dwayne  rock johnson  president",1,1,0,0,1,1,1,2,1,3
"12","California","CA","president biden   son hunter  cnn   great confidence   son

 love   hes   strai… httpstcof1wcwtvlhw",0,1,0,2,2,1,0,2,1,3
"12","Minnesota","MN","ptrhahn seanlangille    joke right    elected president waiting  take office  serious person wo… httpstcojkvergqvl2",0,0,0,0,0,0,0,1,1,1
"12","California","CA","rt womenncri isnt time  eppresident norwaymfa swemfa  foreignoffice  stand   courageous people  iran   iran…",0,1,0,1,0,0,0,0,0,1
"12","Oregon","OR","rt victorshi2020 gen z    running  office  president biden amp democrats  also finding new amp creative ways  reach us…",0,0,0,0,0,0,0,1,0,2
"12","Florida","FL","rt cnnpolitics without detailing specifics president biden says contingencies   gamed   russia use  tactical nuclear w…",0,0,0,0,0,0,0,1,0,1
"12","New York","NY","rt whitehouse  honor  fire prevention week president biden delivered remarks   summit  fire prevention  control httpst…",0,1,0,1,0,0,0,2,0,3
"12","Texas","TX","rt oann oneonone  president   oregon moms union mackensey pulliam httpstcoyox8jhhxag oan",0,0,0,0,0,0,0,1,0,1
"12","New York","NY","karilake    president  vice president",0,0,0,0,0,0,0,1,1,1
"12","California","CA","rt victorshi2020 gen z    running  office  president biden amp democrats  also finding new amp creative ways  reach us…",0,0,0,0,0,0,0,1,0,2
"12","California","CA","rt victorshi2020 gen z    running  office  president biden amp democrats  also finding new amp creative ways  reach us…",0,0,0,0,0,0,0,1,0,2
"12","New Jersey","NJ","thelauracoates alisyncamerota nope therock   run  president  don’t want    tainted  washington dc thesoundoff",0,0,0,0,0,0,0,2,0,2
"12","Michigan","MI","rt igorlachenkov   kyiv today video  published   president volodymyr zelensky httpstcok49ugtzr8s",0,0,0,0,0,0,0,1,0,1
"12","Oregon","OR","rt kylegriffin1 president biden   son hunter  cnn   great confidence   son

 love   hes   straight …",0,1,0,2,2,1,0,2,1,3
"12","Virginia","VA","rt kylegriffin1 president biden   son hunter  cnn   great confidence   son

 love   hes   straight …",0,1,0,2,2,1,0,2,1,3
"12","Oregon","OR","rt bloombergasia president joe biden downplayed  report  federal investigators believe   enough evidence  charge  son h…",0,0,0,0,0,0,0,1,0,1
"12","Nevada","NV","rt rncresearch biden  vast majority   american people  like   got done

biden   unpopular president  modern …",0,0,1,0,1,1,0,2,1,2
"12","Tennessee","TN","rt kylegriffin1 president biden   son hunter  cnn   great confidence   son

 love   hes   straight …",0,1,0,2,2,1,0,2,1,3
"12","Iowa","IA","rt ericschmitt joe biden   worst president  american history  side  woodrow wilson",0,0,0,0,0,0,0,1,0,1
"12","Illinois","IL","rt sebgorka  fbi offered  million dollars   tax money  information  smear president trump 

 fbi   enemy  americ…",2,1,1,1,1,1,2,2,2,3
"12","Virginia","VA","rt georgehahn donald trump lost  2020 presidential election   lot pass  ",0,0,0,0,0,1,1,0,1,0
"12","Oklahoma","OK"," president signed hr7846  law  october 10th 2022 via httpstcosgegwgekeg",0,0,0,0,0,0,0,2,0,1
"12","Pennsylvania","PA","rt warinthefuture  little  three weeks ago  sat   large conference room  kyiv  listened  president zelensky outline …",0,0,0,0,0,0,0,1,0,1
"12","North Dakota","ND","rt rpsagainsttrump new president biden will reevaluate  us relationship  saudi arabia  opec decides  cut oil production…",0,1,0,0,0,0,0,1,0,2
"12","California","CA","rt presidentlokii omg 3 sale cum watch  porn 😈 httpstcoynahfgoeis",0,1,1,1,0,0,0,0,1,0
"12","Oklahoma","OK","rt sethabramson  time given  mbs illegally interfered   2016 presidential election    precisely nothing …",0,1,0,0,0,0,0,0,0,0
"12","Minnesota","MN","rt kylegriffin1 president biden   son hunter  cnn   great confidence   son

 love   hes   straight …",0,1,0,2,2,1,0,2,1,3
"12","Massachusetts","MA","rt kylegriffin1 president biden   son hunter  cnn   great confidence   son

 love   hes   straight …",0,1,0,2,2,1,0,2,1,3
"12","North Carolina","NC","rt kylegriffin1 president biden   son hunter  cnn   great confidence   son

 love   hes   straight …",0,1,0,2,2,1,0,2,1,3
"12","California","CA","rt calltoactivism excellent  conservative group  sued president biden   said  student loan debt cancelation  dis…",0,0,0,0,1,1,0,2,1,2
"12","Texas","TX","rt joncoopertweets frankly ’m sick  tired   corporate media  giving president biden  credit  deserves    accom…",0,0,1,0,0,1,0,2,2,3
"12","Pennsylvania","PA","centristmadness sununu   presidential name hogan presidential name",0,0,0,0,0,0,0,0,0,0
"12","Texas","TX","rt morethanmysle president joe biden will  doling   biggest cola increase  people  social security  40 years  someone o…",0,0,0,0,0,0,0,1,0,2
"12","Georgia","GA","rt occupydemocrats breaking president biden scores  major win  announces  honda  lg energy solution  south korea will build…",0,0,0,0,0,0,0,1,0,4
"12","Iowa","IA","rt jessekellydc  heavy d   unexpected heart attack  president tulsi gets  say   gun rights

nah ’m good keep  …",2,2,0,3,2,0,2,2,3,3
"12","South Carolina","SC","rt hugolowell  guardian doj rejected trump’s scotus motion  several points contending foremost   former president  faile…",0,1,0,0,0,0,1,2,1,2
"12","California","CA","rt yonkojohn  president  pfizer now admits  sole purpose   qr cards  covid   entice  unvaccinated  follow throu…",0,0,0,0,0,0,0,1,0,1
"12","Arizona","AZ","rt kylegriffin1 president biden   son hunter  cnn   great confidence   son

 love   hes   straight …",0,1,0,2,2,1,0,2,1,3
"12","Washington","WA","rt atrupar  biggest presidential scandal  history  president  ever done anything worse",0,0,0,2,0,1,0,1,2,1
"12","New York","NY","edokeefe wait till  tell    guy   president   depression  world war ii",0,1,0,1,0,1,0,1,3,1
"12","California","CA","rolex oyster perpetual daydate black dial automatic mens 18 carat yellow gold president watch 228348bkdp… httpstcox2eb1mkjvf",0,1,0,1,0,1,0,2,1,2
"12","New York","NY","rt chuckcallesto bombshell report pfizer’s janine small president  international developed markets concedes  european parliament co…",0,0,0,0,0,0,0,2,1,1
"12","Texas","TX","rt chuckcallesto breaking report president trump appeals judges decision  toss lawsuit  hillary clinton",1,0,1,1,0,1,2,1,1,1
"12","Missouri","MO","redheadgingerb cnn well look   last socalled president   potential list  candidates wanting  ru… httpstco2voftkzkdb",0,0,0,0,0,1,0,1,1,1
"12","New Mexico","NM","rt chuckcallesto bombshell report pfizer’s janine small president  international developed markets concedes  european parliament co…",0,0,0,0,0,0,0,2,1,1
"12","California","CA","rt herbieziskend46 potus  jaketapper “look  ive gotten done  name   president  recent history   gotten  much don…",0,0,0,0,0,0,0,2,0,2
"12","Washington","WA","sabrasecurity democraticdaisy   celebrities  presidents please reagan got   thats   republi… httpstcowtgj7cg0fi",0,0,0,0,0,0,0,0,0,0
"12","Texas","TX","rt presidentpat  just find  funny  k12 teachers  vilified   engaging students  preparing   college  colleg…",0,0,0,0,1,0,0,1,0,1
"12","North Carolina","NC","rt b52malmet   dad  proud   son  overcoming drug addiction   dad   president   united states  httpstc…",0,1,0,0,1,0,0,3,1,3
"12","Washington","WA","rt kylegriffin1 president biden   son hunter  cnn   great confidence   son

 love   hes   straight …",0,1,0,2,2,1,0,2,1,3
"12","California","CA","rt sethabramson  time given  mbs illegally interfered   2016 presidential election    precisely nothing …",0,1,0,0,0,0,0,0,0,0
"12","Arizona","AZ","rt occupydemocrats breaking president biden demands   los angeles officials   busted making racist remarks  black peo…",1,0,0,1,0,1,0,1,2,1
"12","Ohio","OH","tpostmillennial  know  president seems like  terminator  hes always working   american people… httpstcokch1qdda7e",0,0,0,0,0,0,0,1,0,2
"12","Tennessee","TN","nbcnewsworld crazy president",1,0,0,1,0,1,0,1,1,1
"12","California","CA","droz   planning  take  president dog    anyway don’t  live  jersey  httpstcok0xhaakhx1",0,1,0,0,0,0,0,3,0,3
"12","Michigan","MI","rt msnbc twice  one week republicans  tried  smear vice president kamala harris  times  rhetorical offenses  based…",0,0,0,0,0,0,0,1,1,1
"12","Nebraska","NE","rt jojofromjerz  ’re freaking   president biden dropping  notes   tv interview wait   hear   guy…",0,1,0,0,0,0,0,1,1,1
"12","Virginia","VA","rt occupydemocrats breaking president biden scores  major win  announces  honda  lg energy solution  south korea will build…",0,0,0,0,0,0,0,1,0,4
"12","Louisiana","LA","rt thebradfordfile  fbi capable  trying  throw  presidential election  capable  planning  riot   capitol",1,1,0,1,0,0,0,1,1,1
"12","Iowa","IA","rt ajenglish peru prosecutors lodge new complaint  president pedro castillo hours  detaining five   allies  corruptio…",1,0,0,0,0,0,0,1,1,1
"12","Arizona","AZ","rt marshablackburn  fbi allegedly tried  payout 1 million  corroborate reports  president trump  hillary clinton’s campa…",0,0,0,0,0,0,1,2,0,2
"12","Texas","TX","stillgray uh ’s almost   ’m watching  president",0,0,0,0,0,0,0,1,0,1
"12","Nevada","NV","watcherguru breakingnews 

president biden potus doesn’t know   word recession means

’ve also receive… httpstco141qkyinxz",1,0,1,1,0,1,0,2,1,2
"12","New York","NY","rt whitehouse president biden’s economic plan  created  10 million new jobs – including almost 700000 manufacturing jobs",0,1,0,0,0,0,0,1,0,2
"12","New Jersey","NJ","psg’s hierarchy   blame  making   de facto club president  ’s making      aren’t… httpstcon5pwgqsouy",1,0,1,0,0,0,0,1,1,1
"12","California","CA","2nd   barack hussein obama  gay muslim president  marxist trojan horse  despises america   … httpstcodu1cyvrxx0",0,0,0,0,0,0,0,2,0,1
"12","Wyoming","WY","rt iamchanteezy vice president kamala harris  hillary clinton  owed  apology   right  tulsi gabbard",0,0,0,0,0,0,0,1,1,2
"12","Colorado","CO","washtimes  feel sorry     father   chose  stay  politics rather  care   family    president  don’t",1,0,0,0,0,0,0,3,0,2
"12","Virginia","VA","rt joncoopertweets  agrees president biden  never pardon donald trump ✋",0,0,0,0,0,0,1,1,0,2
"12","Oregon","OR","rockprincess64    point     democrat  hubby   liked    presidential candidates… httpstco4isetb82v1",0,0,0,0,0,0,0,0,0,0
"12","Maine","ME","rt nbcnews fact check president trump falsely claims 180m people will lose health care  joe biden wins httpstcoplpfdk9qje",1,0,1,1,0,1,2,2,2,1
"12","Maryland","MD","rt jojofromjerz  ’re freaking   president biden dropping  notes   tv interview wait   hear   guy…",0,1,0,0,0,0,0,1,1,1
"12","California","CA"," president reacted  news   special counsel   appointed  telling advisors     end … httpstcodclslmgfzh",0,0,0,0,1,0,0,2,0,3
"12","Texas","TX","rt potus  morning  spoke  president zelenskyy  g7 leaders   unwavering commitment  hold russia accountable  …",0,0,0,0,0,0,0,3,1,3
"12","New York","NY","samstein  like  one listened   guy   president  20162020 jeeeez",0,0,0,0,0,0,0,1,0,1
"12","Colorado","CO","rt thebradfordfile  president   united states  denying     recession  everything  tell    lie  …",2,1,2,1,0,2,0,2,3,2
"12","California","CA","rt realjameswoods   united states federal government   pay one million dollars   british spy  upset  american president…",1,1,0,1,1,1,0,3,2,3
"12","California","CA","rt macfarlanenews national archives  obamahw bush records  

reports  indicate  imply   presidential records …",0,0,0,0,0,0,0,0,0,0
"12","Arkansas","AR","rt thebradfordfile  fbi capable  trying  throw  presidential election  capable  planning  riot   capitol",1,1,0,1,0,0,0,1,1,1
"12","Texas","TX","rt atrupar  biggest presidential scandal  history  president  ever done anything worse",0,0,0,2,0,1,0,1,2,1
"12","New York","NY","rt yonkojohn  president  pfizer now admits  sole purpose   qr cards  covid   entice  unvaccinated  follow throu…",0,0,0,0,0,0,0,1,0,1
"12","Indiana","IN","rt beschlossdc trump falsely 2019  “   article ii      right   whatever  want  president    don’t ev…",0,0,0,0,0,0,1,2,1,2
"12","Alabama","AL","rt thebradfordfile  fbi capable  trying  throw  presidential election  capable  planning  riot   capitol",1,1,0,1,0,0,0,1,1,1
"12","California","CA","rt therickydavila president biden  cnn talking   son hunter “  great confidence   son…  love   hes   st…",0,1,0,2,2,1,0,2,1,3
"12","Utah","UT","rt becksedabs ronfilipkowski like president biden said  underestimate women httpstcoqhhz2rzdhg",0,0,0,0,0,0,1,1,0,1
"12","California","CA","rt txtianmiller  donald trump  president meet   possible chinese spy wanted criminal  money launderer id tell  b…",2,1,1,1,1,0,2,2,1,2
"12","Arizona","AZ","rt realjameswoods   united states federal government   pay one million dollars   british spy  upset  american president…",1,1,0,1,1,1,0,3,2,3
"12","Nevada","NV","rt slcute mike lee seems like  guy  ran  class president  jr high high school college  now senate   never stopped…",0,0,0,0,0,0,0,3,0,1
"12","Tennessee","TN","rt swskaggs atrupar still  president httpstcoze39fibyd8",0,0,0,0,0,0,0,1,0,1
"12","Tennessee","TN","rt presidentboyatl   think happened next  dropping soon 🫣 httpstcog2apz3ofia",0,0,0,0,0,0,0,0,0,0
"12","Florida","FL","rt calltoactivism excellent  conservative group  sued president biden   said  student loan debt cancelation  dis…",0,0,0,0,1,1,0,2,1,2
"12","Texas","TX","rt thebradfordfile  fbi capable  trying  throw  presidential election  capable  planning  riot   capitol",1,1,0,1,0,0,0,1,1,1
"12","California","CA","rt occupydemocrats breaking president biden scores  major win  announces  honda  lg energy solution  south korea will build…",0,0,0,0,0,0,0,1,0,4
"12","Minnesota","MN","rt speechboy71    guy  worked   president  wouldn’t give  ukrainians  weapons  needed      f…",0,0,0,0,0,0,0,1,0,1
"12","Missouri","MO","rt nbcpolitics senator tuberville’s comments  flat  racist ignorant  utterly sickening naacp president derrick johnson says…",1,0,2,1,0,1,0,1,2,1
