"created_at","state","code","text","anger","anticipation","disgust","fear","joy","sadness","surprise","trust","negative","positive"
"12","Florida","FL","rt desantiswarroom q can  president require almost 100 million americans  get vaccinated  lose  jobs” 

charliecrist…",1,0,1,1,0,1,1,1,1,1
"12","Michigan","MI","stoolpresidente  mean  long   get pucks  deep cycle  puck get pucks  net  skate    fine",0,1,0,0,0,0,0,0,0,0
"12","Florida","FL","rt toddjleduc usfire drloriusfa summit  fire prevention amp control iaffofficial iaffpresident accesstocancerscreening  chiefdonnab…",0,1,0,1,0,0,0,0,0,1
"12","Florida","FL","   first black president  united states  america httpstco1ogk3nmaxi",0,0,0,0,0,1,0,2,1,2
"12","Minnesota","MN","rt pograssrootm breaking mr  yunusatanko  just  announced   official spokesperson   obidatti presidential campaign c…",0,0,0,0,0,0,0,1,0,0
"12","Texas","TX","omarriverosays wow rivero  great   acknowledged  president president trump  truth speaker  eli… httpstcox84nphvmeh",0,0,0,0,0,0,1,2,0,2
"12","New Mexico","NM","rt bidenswins breaking honda  lg energy solution will build  joint venture ev battery plant  ohio due  president bidens bring…",1,0,0,0,0,0,0,1,1,3
"12","Massachusetts","MA","rt bidenswins raise  hand   love   empathetic president ✋",0,0,0,0,1,0,0,1,0,2
"12","Texas","TX","rt mzhemingway  russian analyst  played  major role   creation   flawed dossier  former president donald trump fabrica…",0,1,0,0,0,0,1,2,0,3
"12","California","CA","rt catturd2 😂 look   three soy boy losers lmao 

leftwing late night hosts floundering  gutfeld dominates  president trump r…",0,0,1,0,0,1,1,1,2,1
"12","California","CA","rt reallyamerican1 drug addiction   nonpartisan issue  fox news thought   use  hurt president biden

instead hannity…",1,1,0,1,0,1,0,1,2,1
"12","North Carolina","NC","rt thatcharises seanlangille   words  law enforcement  intel agencies ran  op   presidential candidate based  info…",1,0,0,0,0,0,0,1,2,1
"12","Pennsylvania","PA","tinubu  stand  3 hours  buhari  yesterday peterobi4president2023",0,0,0,0,0,0,0,1,0,1
"12","Georgia","GA","rt dickesonkathy today  october 12 2022  joe biden   worst president  us history",0,0,0,0,0,0,0,1,0,1
"12","Minnesota","MN","rt crewcrew  former president   incited  violent insurrection  also allegedly took classified government documents  reso…",2,0,1,2,0,0,1,1,3,1
"12","California","CA","rt jojofromjerz  ’re freaking   president biden dropping  notes   tv interview wait   hear   guy…",0,1,0,0,0,0,0,1,1,1
"12","North Carolina","NC","rt alanhalaly protesters  even fully filled  president’s ballroom   taken   podium  sasse  moments ago 

“get…",0,0,0,0,0,0,0,2,0,2
"12","Florida","FL","rt occupydemocrats breaking president biden scores  major win  announces  honda  lg energy solution  south korea will build…",0,0,0,0,0,0,0,1,0,4
"12","Connecticut","CT","rt latimes president biden believes nury martinez   councilmembers  resign   los angeles city council  racist re…",1,1,1,1,0,1,0,2,1,2
"12","Georgia","GA","rt vprasadmdmph insane president said pandemic    60 mins   idiots abuse emergency use authorization  make  acc…",2,0,1,4,0,3,1,2,4,2
"12","Florida","FL","misty028d mikepompeo oh   love  see  become  president one day  love mikepompeo",0,0,0,0,1,0,0,1,0,2
"12","Montana","MT","rt occupydemocrats brraking president biden’s approval rating ticks   44    republicans   awful candidates grow mor…",2,1,1,2,1,2,0,2,2,3
"12","Florida","FL","rt bidenswins breaking honda  lg energy solution will build  joint venture ev battery plant  ohio due  president bidens bring…",1,0,0,0,0,0,0,1,1,3
"12","Florida","FL","rt occupydemocrats breaking president biden scores  major win  announces  honda  lg energy solution  south korea will build…",0,0,0,0,0,0,0,1,0,4
"12","Alabama","AL","rt morethanmysle president joe biden will  doling   biggest cola increase  people  social security  40 years  someone o…",0,0,0,0,0,0,0,1,0,2
"12","Virginia","VA","rt occupydemocrats brraking president biden’s approval rating ticks   44    republicans   awful candidates grow mor…",2,1,1,2,1,2,0,2,2,3
"12","Illinois","IL","rt nbcnews president biden warns  saudi arabia will face consequences  opec last week announced  biggest cut  oil produc…",0,0,0,0,0,0,0,1,0,1
"12","California","CA","rt tudordixon thank  president trump

michigan now   time  build  future  michigan  reduces crime protects families…",1,1,0,0,0,0,1,1,1,2
"12","Washington","WA","rt jojofromjerz  ’re freaking   president biden dropping  notes   tv interview wait   hear   guy…",0,1,0,0,0,0,0,1,1,1
"12","Maryland","MD","fredonce saracarterdc  really feel sorry     able  see  truth   president  harder o… httpstcox6fhywmxsc",0,0,0,0,0,0,0,2,0,2
"12","Alabama","AL","rt calltoactivism excellent  conservative group  sued president biden   said  student loan debt cancelation  dis…",0,0,0,0,1,1,0,2,1,2
"12","Florida","FL","rt nathaliejacoby1  founder  home depot    trump supporter said  president biden  ‘worse  jimmy carter’ 

just cu…",0,0,0,1,1,1,1,2,1,2
"12","California","CA","rt bravowwhl rachel maddow maddow discusses  election deniers  affect  next presidential election wwhl httpstcoyat6d…",0,0,0,0,0,0,0,0,0,0
"12","Texas","TX","rt vprasadmdmph insane president said pandemic    60 mins   idiots abuse emergency use authorization  make  acc…",2,0,1,4,0,3,1,2,4,2
"12","West Virginia","WV","rt savvyrinu tinubu  definitely  showing    presidential debates

know   know peace",0,1,0,0,1,0,0,1,0,1
"12","South Dakota","SD","rt occupydemocrats brraking president biden’s approval rating ticks   44    republicans   awful candidates grow mor…",2,1,1,2,1,2,0,2,2,3
"12","New York","NY","rt hugolowell  guardian doj told scotus   trump truly believed  case    dispute   presidential records act…",1,0,0,1,0,1,1,2,2,1
"12","Washington","WA","rt occupydemocrats brraking president biden’s approval rating ticks   44    republicans   awful candidates grow mor…",2,1,1,2,1,2,0,2,2,3
"12","California","CA","billfoxla secretary mayorkas  president joe biden basically spit  border patrol every day  dont stand u… httpstcoixzx126szs",0,0,1,0,0,0,0,2,0,1
"12","Washington","WA","actbrigitte president biden isn’t  better negotiator   bankruptcy guy  guy  brokered  deal  g… httpstcohlklntamwh",1,1,1,1,1,1,1,2,1,3
"12","California","CA","president biden calls  resignation  3 la city council members amid racism scandal httpstcoowbkcx0s1s",0,2,0,1,0,1,1,3,3,2
"12","Michigan","MI","rt leecamp president biden yet   less  anyone thought possible  trying  solve  catastrophic problems   cr…",0,1,0,0,0,0,0,1,0,1
"12","Pennsylvania","PA","dbongino  biden    president  didn’t win legal election  absentee ballots weren’t received 2 con… httpstcov2kmn9oywo",0,0,0,0,0,1,0,2,1,3
"12","Texas","TX","rt jonathanturley even   addiction defense voiced   president    effort  get  president  explain   h…",1,1,0,1,0,0,0,2,1,4
"12","Missouri","MO","rt jojofromjerz  ’re freaking   president biden dropping  notes   tv interview wait   hear   guy…",0,1,0,0,0,0,0,1,1,1
"12","Florida","FL","sentedcruz  can’t make  shyt  president biden  democrats passed  law  lower  price  prescript… httpstcoidhwvlsy8k",0,0,0,0,0,1,0,2,1,1
"12","Texas","TX","rt bidenswins donald trump  net negative job creation    president president biden  created 10 million jobs  just two…",0,0,0,0,0,1,1,1,1,2
"12","Washington","WA","president biden signs bill allowing divorced couples  sever joint consolidation student loans httpstcogpafxmqsfv",0,0,0,0,0,0,0,1,1,1
"12","Tennessee","TN","rt marshablackburn  fbi allegedly tried  payout 1 million  corroborate reports  president trump  hillary clinton’s campa…",0,0,0,0,0,0,1,2,0,2
"12","Georgia","GA","claytravis president joe biden  july 29 2021 httpstco9mvertch51",0,0,0,0,0,0,0,1,0,1
"12","Kentucky","KY","rt thebradfordfile  fbi capable  trying  throw  presidential election  capable  planning  riot   capitol",1,1,0,1,0,0,0,1,1,1
"12","Florida","FL","rt occupydemocrats brraking president biden’s approval rating ticks   44    republicans   awful candidates grow mor…",2,1,1,2,1,2,0,2,2,3
"12","Oklahoma","OK","rt thedailygripe worst president  modern times pushes tulsigabbard away tulsigabbard 
byedemocrats demexit fjb httpstcoltvzo…",0,0,0,0,0,0,0,1,0,1
"12","Texas","TX","rt crewcrew  former president    credibly accused  committing 55 crimes    charged  one   danger  democra…",1,0,0,2,0,1,0,1,2,1
"12","Colorado","CO","mehdirhasan  clown party gave us  mentally deranged president",1,1,1,1,1,0,1,1,1,2
"12","California","CA","rt breitbartnews breitbart economics  finance editor john carney said  fox business network’s “kudlow”  president joe biden …",0,1,1,0,0,0,0,1,1,1
"12","California","CA","nmcrs welcomes lieutenant general robert r ruark usmc ret   25th president  ceo read  … httpstcozsxbug6muf",0,0,0,0,0,0,0,3,0,2
"12","Virginia","VA","rt iapolls2022 🚨 virginia poll  cnu

governor youngkin
approve 50
disapprove 40

president biden 
approve 39
disapprove 56

701 rv…",1,0,1,1,1,1,0,4,1,2
"12","New Jersey","NJ","pickscentral walker definitely  french guy barstoolbigcat stoolpresidente martymush httpstcoejv28iad51",0,0,0,0,0,0,0,0,0,0
"12","Minnesota","MN","rt bidenswins donald trump  net negative job creation    president president biden  created 10 million jobs  just two…",0,0,0,0,0,1,1,1,1,2
"12","Kentucky","KY","rt thackerpd totally normal   democracies  federal police  offer  1 million bounty  dirt  someone running  president…",0,1,1,1,1,0,0,3,1,4
"12","Massachusetts","MA","rt thebradfordfile  president   united states  denying     recession  everything  tell    lie  …",2,1,2,1,0,2,0,2,3,2
"12","Georgia","GA","rt crewcrew  former president   incited  violent insurrection  also allegedly took classified government documents  reso…",2,0,1,2,0,0,1,1,3,1
"12","Washington","WA","rt senjoniernst  day one president biden declared war  americanmade energy now   face high costs   pump ’s placing …",0,0,0,1,0,0,0,1,1,1
"12","Texas","TX","rt calltoactivism excellent  conservative group  sued president biden   said  student loan debt cancelation  dis…",0,0,0,0,1,1,0,2,1,2
"12","Texas","TX","rt tigerfan519 texans can remember   mattered    governors ambition   president   time   small group  men …",0,2,0,0,1,0,0,2,1,2
"12","Georgia","GA","bidenswins biden   worst president  ever 
   miss  last 2 yrs  total catastrophes   d… httpstcoswwcyxojh1",0,0,0,0,0,0,0,1,0,1
"12","Florida","FL","rt mzhemingway  russian analyst  played  major role   creation   flawed dossier  former president donald trump fabrica…",0,1,0,0,0,0,1,2,0,3
"12","Texas","TX","rt sentedcruz joe biden   worst foreign policy  national security president america  ever seen

  left doesnt underst…",0,0,0,0,0,0,0,2,1,1
"12","Texas","TX","edo rivers missing  peter obi announces presidential campaign council list

 lp announced  appointment … httpstcokysevqap1d",0,1,1,2,0,1,0,1,2,1
"12","New York","NY","rt georgialogcabin biden administration spending 265k  defend presidents son httpstcoymbgul7pee",0,0,0,1,0,0,0,0,0,1
"12","Indiana","IN","rt calltoactivism excellent  conservative group  sued president biden   said  student loan debt cancelation  dis…",0,0,0,0,1,1,0,2,1,2
"12","Florida","FL","rt sentedcruz president biden  delusional america  already   recession
 
httpstcoqv67sbne98",2,0,1,2,0,1,0,1,2,1
"12","Florida","FL","1drcole president biden announced yesterday   stopping  sale  weapons  saudigood call",0,0,0,0,0,0,0,1,0,1
"12","Texas","TX","rt crewcrew  former president    credibly accused  committing 55 crimes    charged  one   danger  democra…",1,0,0,2,0,1,0,1,2,1
"12","South Carolina","SC","rt chrismurphyct fy   condition  getting trump’s endorsement  promising  will work  install   president  2025 even  h…",0,1,0,0,0,0,1,1,0,2
"12","New Jersey","NJ","rt doctorgerhard    example   active president  may physically   hollywood

httpstcoeypjzuuynf",0,0,0,0,0,0,0,1,0,1
"12","New York","NY","rt cuny  mark  jewish holiday  sukkot qcnews hillel  president frankhwu built  sukkah  campus last week chag sameach …",0,1,0,0,1,0,0,1,0,2
"12","Louisiana","LA","rt phillewis  leaked audio los angeles city council president nury martinez says  los angeles district attorney george gascón “fu…",1,1,0,1,0,0,0,3,0,3
"12","Connecticut","CT","rt whitehouse president biden’s inflation reduction act takes  biggest step forward  climate  american history",0,0,0,1,0,0,0,1,1,2
"12","California","CA","rt iamchanteezy vice president kamala harris  hillary clinton  owed  apology   right  tulsi gabbard",0,0,0,0,0,0,0,1,1,2
"12","New York","NY","belarus president alexander lukashenko threatened fierce retribution  ukraine carries   attack   coun… httpstco0u1dsvudjc",3,0,1,3,0,1,0,1,3,1
"12","Delaware","DE","rt judicialwatch    presidents son implicated  criminal activity   evidence  overwhelmingthe presidents also im…",1,0,1,1,0,0,0,0,1,0
"12","New York","NY","rt whitehouse president biden’s inflation reduction act takes  biggest step forward  climate  american history",0,0,0,1,0,0,0,1,1,2
"12","Illinois","IL","rt presidentdebbie santino  30 years nahhh  nigga  cosplaying gen z 😭😭",0,0,0,0,0,0,0,0,0,0
"12","Texas","TX","president biden will never pardon   corrupt criminal traitor 
expresident  us history",2,0,2,2,0,1,0,1,3,2
"12","Louisiana","LA","fatdumbwh0re looks like  portrait ’d    president   white house",0,1,0,0,1,0,0,2,0,2
"12","Nevada","NV","rt marshablackburn  fbi allegedly tried  payout 1 million  corroborate reports  president trump  hillary clinton’s campa…",0,0,0,0,0,0,1,2,0,2
"12","Illinois","IL","rt occupydemocrats brraking president biden’s approval rating ticks   44    republicans   awful candidates grow mor…",2,1,1,2,1,2,0,2,2,3
"12","Massachusetts","MA","rt jcbua new york ap — former president donald trump will   sit   deposition next week   defamation lawsuit filed   wri…",1,0,2,2,0,1,2,1,2,1
"12","Montana","MT","rt joncoopertweets  agrees president biden  never pardon donald trump ✋",0,0,0,0,0,0,1,1,0,2
"12","Virginia","VA"," course    singing  completely different tune  trump  still president   gop controlled  c… httpstcopgrmasgd87",0,0,0,0,0,0,1,1,0,2
"12","Colorado","CO","jimjordan  former president   united states stole thousands  classified documents  anyone believe… httpstcoya8xtolvh4",0,0,0,0,0,0,0,2,0,2
"12","Virginia","VA","view  browser  httpstcob1vrghgrza
 new york times
 
breaking news

president biden named china  russi… httpstcopvshmpawn9",0,0,0,0,0,0,0,1,0,1
"12","New Mexico","NM","rt chrismurphyct fy   condition  getting trump’s endorsement  promising  will work  install   president  2025 even  h…",0,1,0,0,0,0,1,1,0,2
"12","North Carolina","NC","rt sbay     presidential member mean 12

 get gsa membership  2023   discount  2024    includ…",0,0,0,0,0,0,0,0,0,0
"12","Florida","FL","rt patriot0027 breaking uae president sheikh mohamed bin zayed meets russia’s president vladimir putin today  st petersburg

take …",0,0,0,0,0,0,0,1,0,1
"12","Washington","WA","rt occupydemocrats breaking president biden scores  major win  announces  honda  lg energy solution  south korea will build…",0,0,0,0,0,0,0,1,0,4
"12","Ohio","OH","rt whitehouse president biden’s inflation reduction act takes  biggest step forward  climate  american history",0,0,0,1,0,0,0,1,1,2
"12","New Mexico","NM","rt kellda trump lives    alternate reality    still president  everyone calls  sir",0,1,0,0,0,0,1,3,1,2
"12","Texas","TX","rt peterobi  thank  organizers   52nd annual accountants ican conference  especially  58th ican president mallam tijan…",0,0,0,0,0,0,0,1,0,1
"12","Maryland","MD","president biden sat   cnnamp8217s jake tapper   softball interview  cnn anchor asked biden  th… httpstcoxsfqrvzrxu",0,0,0,0,0,0,0,1,0,2
"12","Pennsylvania","PA","rt thebradfordfile lol  fbi actually offered  spy one million dollars  dirt  trump  2016   trying  rig  president…",0,0,1,0,0,0,1,1,1,1
"12","New Jersey","NJ","holluwaphemmy88 victorisrael na  force  go     president yet  can hold  accountable  bec… httpstcokojbiwy9wv",1,0,0,1,0,0,0,2,1,2
"12","Ohio","OH","rt nashishereforit  prefer  president  tells  son  loves   one  tells  daughter shes fuckable",0,0,0,0,1,0,0,2,0,3
"12","New York","NY","rt chuckcallesto breaking report department  justice urges  united states supreme court  reject president trumps maralago raid…",3,1,0,3,0,1,1,3,2,4
"12","California","CA","rt whitehouse president biden’s inflation reduction act takes  biggest step forward  climate  american history",0,0,0,1,0,0,0,1,1,2
"12","Texas","TX","rt rschooley thinking back today    press saved us   president  got dehydrated  httpstcoa3bsjdgvvr",0,0,0,0,0,0,0,1,0,1
"12","Kansas","KS","rt iamchanteezy vice president kamala harris  hillary clinton  owed  apology   right  tulsi gabbard",0,0,0,0,0,0,0,1,1,2
"12","Illinois","IL","republicans  just get     run oj simpson  president",0,0,0,0,0,0,0,1,0,1
"12","California","CA","rt herbieziskend46 potus  jaketapper “look  ive gotten done  name   president  recent history   gotten  much don…",0,0,0,0,0,0,0,2,0,2
"12","Oregon","OR","rt rsbnetwork statement  donald j trump 45th president   united states  america httpstco2m46ofrl8c",0,0,0,0,0,0,1,3,0,3
"12","California","CA","rt thebradfordfile  fbi capable  trying  throw  presidential election  capable  planning  riot   capitol",1,1,0,1,0,0,0,1,1,1
"12","Massachusetts","MA","rt dbongino today  october 12th 2022  joe biden   worst president  us history",0,0,0,0,0,0,0,1,0,1
"12","Arizona","AZ","fortunemagazine   trump becomes president ",0,0,0,0,0,0,1,1,0,1
"12","Hawaii","HI","rt occupydemocrats breaking president biden scores  major win  announces  honda  lg energy solution  south korea will build…",0,0,0,0,0,0,0,1,0,4
"12","Texas","TX","today  national women pharmacist day  celebrate  women  pharmacy

lisa harrison rph president special… httpstco5yochntmkt",0,0,0,0,1,0,0,1,0,2
"12","Ohio","OH","rt whitehouse president biden’s inflation reduction act takes  biggest step forward  climate  american history",0,0,0,1,0,0,0,1,1,2
"12","Maryland","MD","rt rncresearch biden  vast majority   american people  like   got done

biden   unpopular president  modern …",0,0,1,0,1,1,0,2,1,2
"12","North Carolina","NC","stephenm   mean   presidents response caused headlines like  one donald trump vows  answer north… httpstcoga1wm4xibp",0,0,0,0,0,0,1,0,0,0
"12","New Mexico","NM","amatigail foxnews tulsigabbard ron desantis  gabbard  president  2024",0,0,0,0,0,0,0,1,0,1
"12","California","CA","rt lavernspicer  joe biden  president  can’t see  reason   american  keep paying taxes    goes  …",0,0,0,0,0,0,0,1,0,2
"12","Washington","WA","rt kylegriffin1 president biden   son hunter  cnn   great confidence   son

 love   hes   straight …",0,1,0,2,2,1,0,2,1,3
"12","California","CA","rt theleoterrell president trump 75 million voters   continue  support  godblessamerica godblesspresidenttrump",0,1,0,0,0,0,1,2,0,2
"12","Arizona","AZ","rt sentedcruz president biden  delusional america  already   recession
 
httpstcoqv67sbne98",2,0,1,2,0,1,0,1,2,1
"12","New Jersey","NJ","rt whitehouse today president biden  traveling  colorado  establish  camp hale – continental divide national monument

 ac…",0,0,0,0,0,0,0,2,0,4
"12","Florida","FL","rt marshablackburn  fbi allegedly tried  payout 1 million  corroborate reports  president trump  hillary clinton’s campa…",0,0,0,0,0,0,1,2,0,2
"12","Massachusetts","MA","sethwalder ’s presidentjacc ",0,0,0,0,0,0,0,0,0,0
"12","Oklahoma","OK","rt bidenswins president biden fixed  family glitch  will now allow   5 million americans  get financial help  th…",0,0,0,0,0,0,0,2,0,1
"12","Colorado","CO","rt fox8nola city council president helena moreno says reassignment  longtime opso deputy   team appears   pointed political…",0,1,0,0,0,0,0,4,0,2
"12","Colorado","CO","rt kylegriffin1 president biden   son hunter  cnn   great confidence   son

 love   hes   straight …",0,1,0,2,2,1,0,2,1,3
"12","Georgia","GA","rt atrupar ron johnson  suddenly  profiting  family names  presidential grifters httpstcontwbhpnm1z",0,0,0,0,0,0,1,0,0,0
"12","Illinois","IL","laurencewholmes  leilarahimi  joined now  cubs president  baseball operations jed hoyer… httpstco862ble6buh",0,0,0,0,0,0,0,1,0,2
"12","Florida","FL","rt jfleming2870 “will americans really  comfortable   war  nazi germany led   president ’s   wheelchair ’re…",0,0,0,1,0,0,0,1,1,1
"12","Texas","TX","rt abcdtweets happy 150th birthday  ralph vaughan williams rvw150 abcdtweets president johnmrutter  shared  lovely selection o…",0,3,0,0,3,1,2,3,0,4
"12","Georgia","GA","rt gopchairwoman nothing  see  just  sitting president downplaying   son illegally lied   gun form   wrote ab…",1,0,0,1,0,0,0,1,1,1
"12","California","CA","rt crewcrew  know trump held   presidential records  know  regularly conflated presidential duties   businesses ’…",0,0,0,0,0,0,1,0,0,0
"12","Pennsylvania","PA","rt realamvoice peak wealth management president nhopwood1 tells stevegrubershow  realtime market data  moving  fast   w…",0,0,0,0,1,0,0,3,0,3
"12","Georgia","GA","rt unfilteredsteve queernativeyyc yes   exactly    saying    right even  president tried  blame  o…",1,0,1,0,0,0,0,1,1,1
"12","New York","NY","rt crewcrew  former president    credibly accused  committing 55 crimes    charged  one   danger  democra…",1,0,0,2,0,1,0,1,2,1
"12","Nebraska","NE","rt occupydemocrats brraking president biden’s approval rating ticks   44    republicans   awful candidates grow mor…",2,1,1,2,1,2,0,2,2,3
"12","Texas","TX","rt kylegriffin1 president biden   son hunter  cnn   great confidence   son

 love   hes   straight …",0,1,0,2,2,1,0,2,1,3
"12","Nevada","NV","rt georgehahn donald trump lost  2020 presidential election   lot pass  ",0,0,0,0,0,1,1,0,1,0
"12","New York","NY","rt bloombergtv greenlight capital founder  president david einhorn discusses value investing   federal reserves fight  …",1,0,0,1,0,0,0,1,1,1
"12","Washington","WA","rt newday cnn exclusive president biden sits    jaketapper  talk russia saudi arabia running  2024   mjlee h…",0,0,0,0,0,0,0,1,0,2
"12","California","CA","rt marmel also   know  care      things causing  president biden  help stave   rail worker strike…",2,1,0,0,0,0,0,1,3,1
"12","Georgia","GA","rt marmel also   know  care      things causing  president biden  help stave   rail worker strike…",2,1,0,0,0,0,0,1,3,1
"12","Kentucky","KY","rt mzhemingway president trump weighs   extremely bizarre mitt romney plot  sabotage republican party  keep senate democrat  r…",1,0,1,1,0,1,3,2,2,1
"12","Florida","FL","rt iamchanteezy vice president kamala harris knew tulsi gabbard’s number back  2019 

 httpstcoej8cgokmoa",0,0,0,0,0,0,0,1,1,1
"12","Arizona","AZ","rt jojofromjerz  ’re freaking   president biden dropping  notes   tv interview wait   hear   guy…",0,1,0,0,0,0,0,1,1,1
"12","Texas","TX","rt katecagle acting president mitch o’farrell’s head  communications dan halden says  will keep trying  restore order  hold th…",0,0,0,0,0,0,0,1,0,1
"12","Washington","WA","disclosetv persists   kind  gentle word   president said    went   inch  comforting",0,0,0,0,1,0,0,3,0,3
"12","California","CA","rt jojofromjerz potus thank  president biden
promises made promises delivered httpstconpxysudvrd",0,0,0,0,0,0,0,1,0,1
"12","Illinois","IL","rt occupydemocrats breaking president biden boldly predicts  democratic sen raphael warnock will win  election  prolife…",0,0,0,0,0,0,0,1,0,1
"12","California","CA","rbreich   court  radical rightwing  fake imposter president    guantanamo  now  whoever  ",1,1,0,1,0,0,0,1,1,1
"12","Ohio","OH","presidentjacc defensive roty 👀",0,0,0,0,0,0,0,0,0,0
"12","California","CA","rt katecagle update acting president mitch o’farrell just adjourned  los angeles city council meeting protestors shut  ",0,1,0,0,0,0,0,2,0,2
"12","Arizona","AZ","rt hugolowell  guardian doj told scotus   trump truly believed  case    dispute   presidential records act…",1,0,0,1,0,1,1,2,2,1
"12","Texas","TX","rt bcfpresident ’s nothing  racist  insulting   white liberal assuming ’re  liberal  ’re black 😒",1,1,1,1,1,2,0,1,3,2
"12","Utah","UT","uvupresident thanks   reminder president t democracy works      denimandfur coat serious… httpstco1l3efl6xl8",0,0,0,0,0,0,0,1,0,2
"12","Wyoming","WY","rt rsbnetwork statement  donald j trump 45th president   united states  america httpstco2m46ofrl8c",0,0,0,0,0,0,1,3,0,3
"12","Arizona","AZ","rt conservativeo17 president joe biden breaks concerning record 4 months early

httpstcodhtk5x5gt6",0,0,0,0,0,0,0,1,0,1
"12","Texas","TX","rt mfarussia 💬 president putin  stands behind  sabotage   nord streams 

clearly   want  completely sever…",1,0,1,1,0,1,1,1,2,2
"12","Louisiana","LA","rt dbongino today  october 11th 2022  joe biden   worst president  us history",0,0,0,0,0,0,0,1,0,1
"12","South Carolina","SC","rt 51trillion cnn took  massive photo  president trumps inauguration speech gigapixel httpstcovizc3coyhc",0,1,0,0,1,0,0,2,0,3
"12","Oregon","OR","rt kellyo president biden  establishing camp halecontinental divide  colorado  national monument  honor  veteransindigenous pe…",0,0,0,0,0,0,0,2,0,3
"12","Texas","TX","rt occupydemocrats breaking president biden boldly predicts  democratic sen raphael warnock will win  election  prolife…",0,0,0,0,0,0,0,1,0,1
"12","New Jersey","NJ","rt newsmax  us adults  now feeling financially vulnerable amid high inflation —  political risk  president joe biden  …",1,2,1,3,1,1,1,2,3,2
"12","New Jersey","NJ","rt newshour former president donald trump will   answer questions  oath next week   defamation lawsuit lodged   writer w…",1,0,2,2,0,1,2,2,2,3
