"created_at","state","code","text","anger","anticipation","disgust","fear","joy","sadness","surprise","trust","negative","positive"
"12","Indiana","IN","rt whitehouse president biden restored full protection  three national monuments   previous administration attempted  reduce o…",0,0,0,0,0,0,0,1,0,2
"12","Pennsylvania","PA","rt robinyvarra whitehouse    worst president  history",0,0,0,0,0,0,0,1,0,1
"12","Florida","FL","rt jojofromjerz  ’re freaking   president biden dropping  notes   tv interview wait   hear   guy…",0,1,0,0,0,0,0,1,1,1
"12","Illinois","IL","theresachapple   conclusion ’ve reached  “don’t trust presidents   talk  public health”",0,1,0,0,0,0,0,2,0,3
"12","Florida","FL","rt whitehouse president biden restored full protection  three national monuments   previous administration attempted  reduce o…",0,0,0,0,0,0,0,1,0,2
"12","South Carolina","SC","rt gopchairwoman nothing  see  just  sitting president downplaying   son illegally lied   gun form   wrote ab…",1,0,0,1,0,0,0,1,1,1
"12","Louisiana","LA","rt jakenbakelive  met  president  twitch  asked   7030 splits  everyone…

   think  said 🤔 

plz  ban…",0,0,0,0,0,0,0,1,2,1
"12","California","CA","rt thedemocrats  january 2021  unemployment rate   64 now   35

 matches  50year low thanks  president j…",0,0,0,0,0,0,0,1,0,1
"12","Texas","TX","rt thatopboy teni  send una president oooo 😌❤️ love  na weyrey plenty pass   app   shaked   na wahala   st…",0,0,0,0,1,0,0,1,0,2
"12","California","CA","thank  president biden ✌🏼💙🇺🇸",0,0,0,0,0,0,0,1,0,1
"12","Alabama","AL","even pfizer’s president  international marketing admitted    scientific basis  stating   jab w… httpstcoxe0kjrmyie",1,0,0,0,0,0,0,2,0,2
"12","Pennsylvania","PA","rt presidentboyatl treats  everybody eats 🧆 httpstcot2yobya4bm",0,0,0,0,0,0,0,0,0,0
"12","Washington","WA","next  alex jones announces run  presidency citing trumps  im president nobody can touch  theory",0,1,0,0,0,0,0,2,0,1
"12","Massachusetts","MA","suckercarlson testicle tugging tessie

comes 

“ pussy  beautiful ’s worthy   presidential grab”",1,0,0,0,1,0,0,1,1,2
"12","New York","NY","rt backtolife2023 ‘ president   clear covid   ’ white house sends mixed messages  covid
source forbes breaking n…",0,1,0,0,1,0,0,2,0,2
"12","California","CA","rt whitehouse president biden restored full protection  three national monuments   previous administration attempted  reduce o…",0,0,0,0,0,0,0,1,0,2
"12","Alaska","AK","rt whitehouse president biden restored full protection  three national monuments   previous administration attempted  reduce o…",0,0,0,0,0,0,0,1,0,2
"12","California","CA","rt bombshelldaily rescind   trumps appointments   president  convicted  treason      appointees  removed…",1,0,1,1,0,0,1,1,2,1
"12","Florida","FL","rt kylegriffin1  national archives debunks trumps lies  bush 41 documents

reports  indicate  imply   president…",0,0,0,0,0,0,0,1,0,1
"12","Alabama","AL","rt robfinnertyusa everyone  making  huge deal  jaketapper helping  president pick   notes   dropped   …",0,1,0,0,1,0,1,2,0,3
"12","Minnesota","MN","rt morethanmysle 🔥🔥president joe biden will  doling   biggest cola increase  people  social security  40 years  someone…",0,0,0,0,0,0,0,1,0,2
"12","Texas","TX","rt maxabrahms  trump    media     tantrum    president used  power  try  advance political go…",0,1,0,1,1,0,2,1,0,2
"12","Pennsylvania","PA","rt bidenswins donald trump  net negative job creation    president president biden  created 10 million jobs  just two…",0,0,0,0,0,1,1,1,1,2
"12","California","CA","rt thedemocrats  january 2021  unemployment rate   64 now   35

 matches  50year low thanks  president j…",0,0,0,0,0,0,0,1,0,1
"12","New York","NY","rt reuters president joe biden pledged ‘ will  consequences’  us relations  saudi arabia  opec announced last week…",0,0,0,0,0,0,0,1,0,1
"12","Florida","FL","woodmonet1978 georgehahn finally  tells  truth  something  now       president",0,1,1,0,1,0,1,3,0,3
"12","Tennessee","TN","rt breaking911 president biden first lady jill biden wish joy behar  happy birthday  one  better named  ”

 httpstco…",0,2,0,0,3,0,1,2,0,4
"12","Arkansas","AR","rt shaneharris new trump worker told fbi  moving maralago boxes  expresident’s orders httpstcoaj8fxaesve big ol scoop f…",0,0,0,0,0,0,1,0,0,0
"12","Indiana","IN","trump worker told fbi  moving maralago boxes  expresident’s orders httpstcojh3p0fmsui httpstcoc0bxw0bg6z",0,0,0,0,0,0,1,0,0,0
"12","Texas","TX","working   brasil presidential race  giving   crash course  portuguese",0,0,0,1,0,1,1,0,1,2
"12","Virginia","VA","rt rosskneedeep   feel  trumps ineptness  president  caused   hatred towards president obama",1,0,1,1,0,1,0,1,1,1
"12","Virginia","VA","kindadead nothing like bastion orisa og shield reinhardt    payload shit  like protect  president",2,0,1,0,0,0,0,1,1,3
"12","Alabama","AL","rt rockprincess818  miss  good old days  trump  president    war economy  booming inflation  nonexistent…",0,1,0,2,1,0,2,3,2,2
"12","Minnesota","MN","rt bidenswins donald trump  net negative job creation    president president biden  created 10 million jobs  just two…",0,0,0,0,0,1,1,1,1,2
"12","Ohio","OH","rt rrcityschools congratulations  rrschools board  education president addie olander  earning  2022 ohio school boards associa…",0,1,0,0,0,0,0,2,0,1
"12","Pennsylvania","PA","rt jojofromjerz  ’re freaking   president biden dropping  notes   tv interview wait   hear   guy…",0,1,0,0,0,0,0,1,1,1
"12","California","CA","rt yorukhunnn tpyxanews president zelenskyys evening appeal subbed  english httpstco7p2br1tc6f",0,1,0,0,0,0,0,1,0,1
"12","California","CA","rt terikanefield trump usually loses  court    president   able  leverage  position   courts since becomi…",1,1,0,1,0,0,1,1,0,2
"12","New York","NY","rt beschlossdc  white house   official name given   executive mansion  new president theodore roosevelt today 1901 htt…",0,1,0,0,1,0,0,3,0,2
"12","Montana","MT","rt georgehahn donald trump lost  2020 presidential election   lot pass  ",0,0,0,0,0,1,1,0,1,0
"12","Arizona","AZ","rt realjameswoods   united states federal government   pay one million dollars   british spy  upset  american president…",1,1,0,1,1,1,0,3,2,3
"12","Alabama","AL","rt oliviatroye glad  trump employee  cooperating   investigation  documents   belong   former president fur…",0,2,0,0,1,0,1,2,0,3
"12","Rhode Island","RI","maxboot  thinks  trump  president  country   voted  nicaragua  north korea",0,0,0,0,0,0,1,1,0,1
"12","Illinois","IL","rt lavernspicer  joe biden  president  can’t see  reason   american  keep paying taxes    goes  …",0,0,0,0,0,0,0,1,0,2
"12","Texas","TX","jakeshieldsajj covid    vaccines  complete bs pushed   presidents  president   don… httpstcoht7k7vsz9t",0,0,0,0,0,0,0,2,0,2
"12","Nebraska","NE","rt phillewis los angeles ap — exlos angeles city council president nury martinez resigns council seat amid uproar  racist remark…",0,1,0,0,0,0,0,2,1,2
"12","Texas","TX","rhodz shashi  president

 wish  employers  like    empower  people  work bette… httpstcolixggzltup",0,0,0,0,0,0,0,1,0,2
"12","Oklahoma","OK","rt malflexutaro  doesnt get  elite   president   united states    accountability    said https…",0,1,0,0,1,0,0,4,0,4
"12","Ohio","OH","geraldorivera appears    bad movebut  crisis
   hand    sitting president  appear… httpstcovvxgwiefae",1,0,1,1,0,1,0,1,2,1
"12","California","CA","rt whitehouse president biden restored full protection  three national monuments   previous administration attempted  reduce o…",0,0,0,0,0,0,0,1,0,2
"12","California","CA","rt whitehouse president biden restored full protection  three national monuments   previous administration attempted  reduce o…",0,0,0,0,0,0,0,1,0,2
"12","Kentucky","KY","rt mrjags today apc presidential candidate bola ahmed tinubu officialabat   running mate senator kashim shettima kashimsm dur…",0,0,0,0,0,0,0,1,0,2
"12","Texas","TX","rt shaneharris new trump worker told fbi  moving maralago boxes  expresident’s orders httpstcoaj8fxaesve big ol scoop f…",0,0,0,0,0,0,1,0,0,0
"12","Iowa","IA","rt bidenswins donald trump  net negative job creation    president president biden  created 10 million jobs  just two…",0,0,0,0,0,1,1,1,1,2
"12","Indiana","IN","rt jojofromjerz  ’re freaking   president biden dropping  notes   tv interview wait   hear   guy…",0,1,0,0,0,0,0,1,1,1
"12","California","CA","rt whitehouse president biden restored full protection  three national monuments   previous administration attempted  reduce o…",0,0,0,0,0,0,0,1,0,2
"12","New Jersey","NJ","rt doctorgerhard    example   active president  may physically   hollywood

httpstcoeypjzuuynf",0,0,0,0,0,0,0,1,0,1
"12","Oregon","OR","rt auronmacintyre   helps  isn’t really  president   way  matters",0,0,0,0,0,0,0,1,0,1
"12","Virginia","VA","rt dcexaminer president joebiden incorrectly said  late son beau lost  life  iraq httpstcooz9gryrjci httpstco8ovjbq…",0,0,0,0,0,2,0,1,2,1
"12","Florida","FL","thank  president biden 💙",0,0,0,0,0,0,0,1,0,1
"12","Massachusetts","MA","occupydemocrats trump 2024  lets go baby  best president ever",0,0,0,0,1,0,1,1,0,2
"12","Washington","WA","bluemangos nancyloumartin ericmmatheny  president   united states even stated   ’s just 4 words btw",1,0,0,0,0,0,0,2,1,2
"12","North Carolina","NC","rt folkwise13 iryna volshayna wins  new presidential award  meritorious service  work ’s done  preserve ukrainian culture…",0,1,0,0,2,0,1,2,0,4
"12","Utah","UT","rt nytimes  us   new national monument camp hale  colorado president biden announced  wednesday  move  protects tens…",0,0,0,0,0,0,0,1,0,3
"12","Hawaii","HI","rt gopchairwoman nothing  see  just  sitting president downplaying   son illegally lied   gun form   wrote ab…",1,0,0,1,0,0,0,1,1,1
"12","New Jersey","NJ","cnn   trump employee  told  fbi   directed   former president  move boxes    basem… httpstcoowkeiibwmf",0,0,0,0,0,0,1,1,0,1
"12","Florida","FL","dickesonkathy next president",0,0,0,0,0,0,0,1,0,1
"12","Texas","TX","rt realjameswoods   united states federal government   pay one million dollars   british spy  upset  american president…",1,1,0,1,1,1,0,3,2,3
"12","New York","NY","rt dcexaminer president joebiden incorrectly said  late son beau lost  life  iraq httpstcooz9gryrjci httpstco8ovjbq…",0,0,0,0,0,2,0,1,2,1
"12","Louisiana","LA","rt listenhere12 stephenm  remember   president  allowed russia  review americas nuclear secrets   white house  hav…",0,1,0,0,1,0,0,2,0,2
"12","Wisconsin","WI","rt realjameswoods   united states federal government   pay one million dollars   british spy  upset  american president…",1,1,0,1,1,1,0,3,2,3
"12","Colorado","CO","rt historycolorado  todays news  president joebiden   co  designate camp hale   national monument  taking  loo…",0,0,1,0,0,0,0,1,1,3
"12","Oklahoma","OK","rt conservatron1 rules  tried  put government spying  us citizens  check  mysteriously removed friday  president biden t…",0,0,0,1,0,0,0,1,1,1
"12","Pennsylvania","PA","presidentembiid can jo  fall   floor one year though",0,0,0,0,0,1,0,0,1,0
"12","Texas","TX","rt czesc45 ’m proud   american  ’m proud  support president trump 

            🇺🇸 𝐌  𝐀  𝐆  𝐀 🇺🇸 httpstcopzgmelqvou",0,1,0,0,1,0,1,2,0,2
"12","Kentucky","KY","presidentniki ill make   submissive httpstcoiuez8utsrj",1,0,1,1,0,1,0,0,1,0
"12","New Mexico","NM","rt whitehouse happening now president biden  vice president harris attend  second meeting   task force  reproductive health…",1,0,0,1,1,0,0,1,2,3
"12","Florida","FL","rt whitehouse president biden restored full protection  three national monuments   previous administration attempted  reduce o…",0,0,0,0,0,0,0,1,0,2
"12","Georgia","GA","rt oilfieldrando ’ve  troops  syria  three presidents  ’s gotten one billionth   media coverage  ukraine 

ma…",0,0,0,0,0,0,0,0,0,0
"12","Arizona","AZ","rt calltoactivism excellent  conservative group  sued president biden   said  student loan debt cancelation  dis…",0,0,0,0,1,1,0,2,1,2
"12","Michigan","MI","replisamcclain congratulations  calling  mr president   doesn’t see  tweets   don’t potus  … httpstcoeh9r3rgvit",0,0,0,0,0,0,0,2,0,2
"12","Florida","FL","rt jojofromjerz  ’re freaking   president biden dropping  notes   tv interview wait   hear   guy…",0,1,0,0,0,0,0,1,1,1
"12","New York","NY","rt saharareporters peter obi picks ebonyi indigene  lead presidential campaign  sokoto another igbo man  lagos campaign coordinato…",0,0,1,1,0,0,0,0,1,1
"12","Minnesota","MN","2016  trump won  russia interfered worst president ever",0,0,0,0,0,0,1,1,0,1
"12","Maine","ME","rt realjameswoods   united states federal government   pay one million dollars   british spy  upset  american president…",1,1,0,1,1,1,0,3,2,3
"12","Michigan","MI","rt npage321  still feel comeys letter just  election day cost hillary clinton  presidential election",0,1,0,0,0,0,0,0,0,0
"12","California","CA","rt desantiswarroom q can  president require almost 100 million americans  get vaccinated  lose  jobs” 

charliecrist…",1,0,1,1,0,1,1,1,1,1
"12","Alabama","AL","rt sandrasentinel fbi   dismantled  agency played politics   trump    president      enforcem…",1,0,0,0,0,0,1,1,0,1
"12","Texas","TX","rt whitehouse president biden restored full protection  three national monuments   previous administration attempted  reduce o…",0,0,0,0,0,0,0,1,0,2
"12","Colorado","CO","rt jojofromjerz cnn   trump employee  told  fbi   directed   former president  move boxes    basement st…",0,0,0,0,0,0,1,1,0,1
"12","Florida","FL","rt potus   first year  office  protected  lands  waters   american president since john f kennedy
 
 since …",0,0,1,0,0,0,0,2,1,1
"12","Pennsylvania","PA","dineshdsouza   “major” like formerpresidentstealsnuclearsecretsandpossiblysellsthemfortwo billiondo… httpstcodhrbu4qg8i",0,0,0,0,0,0,0,0,0,1
"12","New York","NY","time  prune presidential rulemaking —  new bicameralism  presentment httpstcocwuwbcc1rt via reason",0,1,0,0,0,0,0,0,1,2
"12","Washington","WA","rt occupydemocrats brraking president biden’s approval rating ticks   44    republicans   awful candidates grow mor…",2,1,1,2,1,2,0,2,2,3
"12","Oregon","OR","rt potus   first year  office  protected  lands  waters   american president since john f kennedy
 
 since …",0,0,1,0,0,0,0,2,1,1
